,subreddit,body,comment_score,self_url,title,comment,link,score,clusters
4619,pics,,27,https://www.reddit.com/r/pics/comments/48ze5m,Amazing Lego creation.,"That ""rock"" base looks like its full of illegal connections everywhere",http://reddit.com/r/pics/comments/48ze5m/c/d0nwj57,3922,1
4632,pics,,64,https://www.reddit.com/r/pics/comments/4cgdxe,A visualization of how many Earth[s] could fit into the sun.,"Damn, that's gotta be at least 12.",http://reddit.com/r/pics/comments/4cgdxe/c/d1i5s5m,1021,1
4639,pics,,223,https://www.reddit.com/r/pics/comments/48vgwz,Fairy tale castles actually exist. This is Dunrobin castle in Scotland.,This says it was used as a boarding school. I would feel like I'm at Hogwarts if I went to a school that looked like that. ,http://reddit.com/r/pics/comments/48vgwz/c/d0mxh56,5128,1
4661,pics,,33,https://www.reddit.com/r/pics/comments/49lp6t,Table for two,Reminds me of that thing General Grievous drives around in.,http://reddit.com/r/pics/comments/49lp6t/c/d0swlwy,2232,1
4665,pics,,39,https://www.reddit.com/r/pics/comments/49qcuu,Metal Peacock,"I got cards, an etsy, and a Facebook page! No website yet. My Etsy and Facebook are The Spoon Girl. Not much on my Etsy yet though. ",http://reddit.com/r/pics/comments/49qcuu/c/d0ucokb,5454,1
4667,pics,,235,https://www.reddit.com/r/pics/comments/4c54nh,Koala holds up highway traffic,He is training to become a policeman....he is koalafied. ,http://reddit.com/r/pics/comments/4c54nh/c/d1f47r2,4462,5
4668,pics,,22,https://www.reddit.com/r/pics/comments/4anod2,My Snake escaped. 3 days later this is what I came home to. Found him!!!,"Same here, I looked down in fear",http://reddit.com/r/pics/comments/4anod2/c/d11wdlt,1162,7
4670,pics,,32,https://www.reddit.com/r/pics/comments/4abyq0,A beach in Key West that was trashed by spring breakers this past weekend. Posted by a Facebook friend who lives there,Don't cheap hotel owners and cheap restauranteurs and cheap bars also need some income to pay their employees too though?,http://reddit.com/r/pics/comments/4abyq0/c/d0zcwcd,3147,1
4671,pics,,22,https://www.reddit.com/r/pics/comments/49d4bt,WTF,Wow That's Fascinating ,http://reddit.com/r/pics/comments/49d4bt/c/d0qzyj9,3069,1
4680,pics,,44,https://www.reddit.com/r/pics/comments/4asskg,My uncle almost died yesterday. 99% blockage. Stints work.,"Hahaha I fully own that, but I meant that stints at hospitals work. ",http://reddit.com/r/pics/comments/4asskg/c/d13dbcj,1480,1
4705,pics,,37,https://www.reddit.com/r/pics/comments/48slr4,Didn't expect to see a car like this in Cambodia, *It may be a Ford engine in a purpose built tubular frame.,http://reddit.com/r/pics/comments/48slr4/c/d0m7i3y,1976,5
4708,pics,,334,https://www.reddit.com/r/pics/comments/4aeq00,"No, it's not","It's not a repost?? Sure it is. Many, many times over.",http://reddit.com/r/pics/comments/4aeq00/c/d0zpvaz,2606,0
4710,pics,,27,https://www.reddit.com/r/pics/comments/4apmoe,A young Barack Obama enjoying time on the beach with his grandfather,how are you just learning this,http://reddit.com/r/pics/comments/4apmoe/c/d12fr35,67,1
4719,pics,,47,https://www.reddit.com/r/pics/comments/4c0xwr,Found this couple's SD card while traveling in New Zealand - does anyone out there recognize them?,They look German to me. I would start by going to Germany. ,http://reddit.com/r/pics/comments/4c0xwr/c/d1e4z7o,293,0
4738,pics,,43,https://www.reddit.com/r/pics/comments/48lpqu,Abandoned Library,. Lori and her partner make everything by hand and photograph using 8x10 negative film. There is no digital manipulation of her images as everything is created with analogue equipment. I used to work with Lori and her work is absolutely amazing. ,http://reddit.com/r/pics/comments/48lpqu/c/d0kzi3v,2129,1
4739,pics,,23,https://www.reddit.com/r/pics/comments/4cqvaq,"Guy parked in the front handicap spot with no special tags, just a typical douche.",There it is folks. Let's wrap it up and go home.,http://reddit.com/r/pics/comments/4cqvaq/c/d1kno4d,50,1
4745,pics,,22,https://www.reddit.com/r/pics/comments/49zhmj,Local liquor store always puts up a little current event poem,"There's a parallel with the two main kinds of love, eros and agape.  Eros is the love of marriage.  It's where you give yourself to the other and is therefore exclusive.  It is also the love Jesus commanded us to have for God: ""Love the Lord your God with all your heart and with all your soul and with all your strength and with all your mind"".  Agape is giving what you have for the other.  This is the kind of love you should have for your neighbor.  The things you have, like money, talent, effort, and time are what you can give to them or Caesar/neighbors/community.  ",http://reddit.com/r/pics/comments/49zhmj/c/d0wpcch,2194,1
4767,pics,,33,https://www.reddit.com/r/pics/comments/49zsq8,And that's how cyclists pee,You gain a strange kind of respect for these athletes when you see something like that.,http://reddit.com/r/pics/comments/49zsq8/c/d0wa5gv,286,0
4789,pics,,39,https://www.reddit.com/r/pics/comments/4c9hzu,Cute little fish,I bet he looks even better in some water,http://reddit.com/r/pics/comments/4c9hzu/c/d1gbqm1,583,1
4796,pics,,70,https://www.reddit.com/r/pics/comments/4a4rur,Lola and her murder mittens !!!,"And a deep, bone-chilling purr",http://reddit.com/r/pics/comments/4a4rur/c/d0xjb86,5634,1
4797,pics,,82,https://www.reddit.com/r/pics/comments/48rrp9,A freshly groomed ski slope.,Why do you groom snow like this?  Sorry never been skiing before or anything like that...and I live in CO wtf.,http://reddit.com/r/pics/comments/48rrp9/c/d0m8dcn,4955,1
4822,pics,,63,https://www.reddit.com/r/pics/comments/48hgy4,Religious love,"Anti-religious agenda on reddit? Get out. Next your going to tell me that this isn't even OP's photo, or that the original was probably fake too! What kind of drugs are you on, comrade?? ",http://reddit.com/r/pics/comments/48hgy4/c/d0jnxfh,243,1
4830,pics,,47,https://www.reddit.com/r/pics/comments/4ajugu,Ironpool costume is crazy cool,This is my big complaint with Superman.  He's basically able to do everything.  He is essentially a god. Except there is a rare element that can have different effects on him...I just can't dig it.,http://reddit.com/r/pics/comments/4ajugu/c/d11ewne,4083,1
4834,pics,,41,https://www.reddit.com/r/pics/comments/4choyq,One if my 4th graders did this in photography club.,But it's a flower...,http://reddit.com/r/pics/comments/4choyq/c/d1irtv7,4351,1
4835,pics,,47,https://www.reddit.com/r/pics/comments/4cnvff,"The way I eat my crab, the way you should","Honestly, it shows skill as a found object sculptor.  This would probably get the sculptor into art school as a portfolio piece.",http://reddit.com/r/pics/comments/4cnvff/c/d1k971m,4557,1
4839,pics,,90,https://www.reddit.com/r/pics/comments/4cgy5i,Titus the Albanian Pitbull,A dog cosplaying as a cheetah,http://reddit.com/r/pics/comments/4cgy5i/c/d1i79ap,4363,1
4852,pics,,35,https://www.reddit.com/r/pics/comments/4b77wz,Twilight falls around the world,Oh these again.  Do people really think these are real?,http://reddit.com/r/pics/comments/4b77wz/c/d16sq22,449,1
4853,pics,,30,https://www.reddit.com/r/pics/comments/49ec7u,Hole in my hand! (SFX makeup),"Please tilt hand, 5 degrees to the right.",http://reddit.com/r/pics/comments/49ec7u/c/d0r4fif,83,1
4871,pics,,99,https://www.reddit.com/r/pics/comments/49f2aa,A list of 17306 people drowned in attempt to emigrate. Members of the European Parliament are forced to walk over it to get to work.,They aren't. This is leftist propaganda based on white guilt.,http://reddit.com/r/pics/comments/49f2aa/c/d0rraea,628,1
4881,pics,,97,https://www.reddit.com/r/pics/comments/4aglny,Breakfasts from around the world,I am Canadian and have lived here my whole life.... traveled all over the country and I have never in my life had a pierogi for breakfast...,http://reddit.com/r/pics/comments/4aglny/c/d1078je,234,1
4890,pics,,137,https://www.reddit.com/r/pics/comments/4awu3w,"Woke up during wisdom tooth surgery, took selfies.",def a bad idea to be suckin that juice homie,http://reddit.com/r/pics/comments/4awu3w/c/d14762d,512,3
4892,pics,,53,https://www.reddit.com/r/pics/comments/48en3z,How the hell do cats even work,This looks like something I'd hear about from a spooky campfire story.,http://reddit.com/r/pics/comments/48en3z/c/d0j2n7i,5130,1
4907,pics,,25,https://www.reddit.com/r/pics/comments/4ckl0b,Rare Black Leopard,I loved that little guy.  Every now and then he would get caught by a big guy and go down almost immediately.  Then all bets are off as I go in spears blazing trying to save him.,http://reddit.com/r/pics/comments/4ckl0b/c/d1j6k5c,5206,1
4917,pics,,24,https://www.reddit.com/r/pics/comments/4b3irb,A polar bear on a rock,FUCK YOU DON'T TELL ME WHAT TO DO,http://reddit.com/r/pics/comments/4b3irb/c/d1645dl,4799,1
4930,pics,,41,https://www.reddit.com/r/pics/comments/4a3ugz,Coffee vendor at Burning Man,The people provide. ,http://reddit.com/r/pics/comments/4a3ugz/c/d0xk4om,5591,1
4965,pics,,52,https://www.reddit.com/r/pics/comments/4c3ho2,"Found this pup running free in my neighborhood. Thankfully, she was chipped and we returned her home hours later. But for 5 sweet hours we had a new best friend.",I would be very tempted to dognap that puppy.,http://reddit.com/r/pics/comments/4c3ho2/c/d1equh7,4518,1
4967,pics,,91,https://www.reddit.com/r/pics/comments/49pid2,I'm cross-stitching the solar system! My progress so far..,"Sorry, I don't. They each take way too much time to make it really worthwhile to sell them. ",http://reddit.com/r/pics/comments/49pid2/c/d0u4stf,5761,1
4970,pics,,24,https://www.reddit.com/r/pics/comments/4b3bcz,School Photo 1961,I assumed schoolyard fight. I must be quaint.,http://reddit.com/r/pics/comments/4b3bcz/c/d15zueq,2138,3
4975,pics,,20,https://www.reddit.com/r/pics/comments/49gzfe,Crazy guy with a hammer,Dave Grohl is hear to hammer your eardrums with some sweet tunes.,http://reddit.com/r/pics/comments/49gzfe/c/d0rr4hf,39,1
4984,pics,,39,https://www.reddit.com/r/pics/comments/4cavy5,Iraqi girls at Peace Carnival in Baghdad to counter ISIS efforts to destroy civilian life,"Lmao. ""I've been angrily shitposting from the safety of  my parents basement, therefore I am superior to this little girl who attended a protest(or whatever this is) who lives somewhere where ISIS is an actual threat""",http://reddit.com/r/pics/comments/4cavy5/c/d1gs34w,3725,1
4986,pics,,26,https://www.reddit.com/r/pics/comments/4c65ch,"Hot Dog Shop offers ""Trump Footlongs"" that are only 3 inches long...",Is there? Because my community would be better off with more poor people going to community college than my community is improved by more people being killed in my name on another continent.,http://reddit.com/r/pics/comments/4c65ch/c/d1fuxri,3704,1
4987,pics,,27,https://www.reddit.com/r/pics/comments/4c7l1m,My niece made a cake for Easter. She has had 16 years of Catholic education.,http://imgur.com/JjtROqa,http://reddit.com/r/pics/comments/4c7l1m/c/d1g8qyk,3162,1
4991,pics,,27,https://www.reddit.com/r/pics/comments/4bj0i2,Saw this 'Murican on the freeway who had a message for ISIS,ISIS is really scared of American hillbillies.,http://reddit.com/r/pics/comments/4bj0i2/c/d19kkby,261,1
4999,pics,,216,https://www.reddit.com/r/pics/comments/4a9xst,"Drunk guy ordered a pizza with every topping, against our advice..",Must have been a buddhist. Make me one with everything.,http://reddit.com/r/pics/comments/4a9xst/c/d0ykxjb,2811,7
5007,pics,,121,https://www.reddit.com/r/pics/comments/4bks1t,I think my uncle is Austin Powers.,"Yeah, Baby!",http://reddit.com/r/pics/comments/4bks1t/c/d1a2aot,4793,1
5013,pics,,32,https://www.reddit.com/r/pics/comments/4akv3o,My cat every morning while I'm in the shower.,"He actually will jump from any appliance, piece of furniture, whatever he can...just to jump on me. Sometimes, he flat foots it from the ground, right up my back or chest. Then he just sits on my shoulder. He's got zero awareness of personal space. ",http://reddit.com/r/pics/comments/4akv3o/c/d11bks5,815,7
5025,pics,,24,https://www.reddit.com/r/pics/comments/4b0b0d,Snapped a lucky shot of a truck trying to steal the sun.,Actually this was taken in Doha Qatar.,http://reddit.com/r/pics/comments/4b0b0d/c/d159kv8,6140,1
5055,pics,,21,https://www.reddit.com/r/pics/comments/49doe5,Good life advice, formatting,http://reddit.com/r/pics/comments/49doe5/c/d0rkmd5,4565,1
5059,pics,,79,https://www.reddit.com/r/pics/comments/491uzs,2 minutes old new born,Aren't rabbits fully bald when they are born? They grow fur like this after 2-3 days ,http://reddit.com/r/pics/comments/491uzs/c/d0ohrcl,2158,1
5066,pics,,21,https://www.reddit.com/r/pics/comments/48d5mf,Sport better than the other team!,this joke has never been good. ,http://reddit.com/r/pics/comments/48d5mf/c/d0isgqa,72,1
5085,pics,,35,https://www.reddit.com/r/pics/comments/48xiyt,Picknick tables make great Pirate ships (OC),I was thinking the same! Even the sky looks Dutch!,http://reddit.com/r/pics/comments/48xiyt/c/d0nldp6,4555,1
5086,pics,,155,https://www.reddit.com/r/pics/comments/4c2ah9,So this is what a baby beaver looks like,Needs more banana. ,http://reddit.com/r/pics/comments/4c2ah9/c/d1enp6w,6072,1
5089,pics,,40,https://www.reddit.com/r/pics/comments/49kihr,"Venus from the ground and from 10,000 feet.","Well, a GoPro would disintegrate from the caustic atmosphere of Venus.",http://reddit.com/r/pics/comments/49kihr/c/d0spund,2369,1
5091,pics,,205,https://www.reddit.com/r/pics/comments/49znph,My Buddy Lives in Vietnam and Came Across this Homemade Gym,Lift something heavy until it isn't heavy anymore. then lift some thing heavier. ,http://reddit.com/r/pics/comments/49znph/c/d0w7902,2400,1
5108,pics,,20,https://www.reddit.com/r/pics/comments/49jc5p,Went out for a smoke...came back with freedom,"Yeah, for a sec there I thought OP was an asshole, then I looked that up. Nice work OP.",http://reddit.com/r/pics/comments/49jc5p/c/d0sgqbr,1421,1
5112,pics,,26,https://www.reddit.com/r/pics/comments/4ag4k1,Kim Possible,I usually watch the Disney Channel without my pants on. ,http://reddit.com/r/pics/comments/4ag4k1/c/d104ocx,564,1
5114,pics,,21,https://www.reddit.com/r/pics/comments/4ar930,My dad's view from his hotel,$400+,http://reddit.com/r/pics/comments/4ar930/c/d12zd7c,6305,0
5116,pics,,71,https://www.reddit.com/r/pics/comments/48qfto,Growing up with prosthetic legs.,Nice to see the kids stumping for Bernie.,http://reddit.com/r/pics/comments/48qfto/c/d0lvfhn,3814,1
5118,pics,,21,https://www.reddit.com/r/pics/comments/4a4jr5,poker room now complete,Where's the picture with the dogs and the cards and cigars?,http://reddit.com/r/pics/comments/4a4jr5/c/d0xbmgk,1903,1
5141,pics,,22,https://www.reddit.com/r/pics/comments/49y5yx,My friend was in the right place at the right time with his drone.,The world is missing Heath,http://reddit.com/r/pics/comments/49y5yx/c/d0vuvex,2147,1
5146,pics,,21,https://www.reddit.com/r/pics/comments/4aekzx,"I went to see the Arctic Ocean, this is what it looked like.","GPS now, cairns (Inukshuk in the Arctic) before that. Those little piles of stones you see every now and again? They actually have a use. You walk until you can almost not see the last one and you build another. Stops you walking in circles.",http://reddit.com/r/pics/comments/4aekzx/c/d10bc6j,4369,1
5152,pics,,39,https://www.reddit.com/r/pics/comments/4cioib,What the fuck is up with that toe?,Butter toes ,http://reddit.com/r/pics/comments/4cioib/c/d1ik0re,94,2
5155,pics,,47,https://www.reddit.com/r/pics/comments/4au13o,"1 Year Transition timeline (I wanted to share today hoping some people would find this inspiring, and brighten their day!)","Here, let me help it figure out whats going on!",http://reddit.com/r/pics/comments/4au13o/c/d13ho6e,222,4
5167,pics,,25,https://www.reddit.com/r/pics/comments/48kfv2,I pass this truck everyday going into work.,"She can have mine. I'm healthy, don't smoke. Type O positive. What would go into getting this girl my kidney?",http://reddit.com/r/pics/comments/48kfv2/c/d0kekcg,1903,1
5172,pics,,25,https://www.reddit.com/r/pics/comments/4aimeg,"My motorcycle broke down near a little town in Guatemala. Met these guys drinking in an auto parts store and they offered to ""take us to lunch"". We couldn't refuse.",Gentlemen,http://reddit.com/r/pics/comments/4aimeg/c/d1148zr,1117,5
5177,pics,,22,https://www.reddit.com/r/pics/comments/4c3z3f,So I dyed some eggs tonight..,"I had a customer complain that we were out of the tablets at the retail store I worked at and I pointed him to the food coloring. He just said, ""Thanks, but I'll just keep looking."" I always grew up with the food coloring method. If you're waiting to buy until the day before Easter and every place is sold out, can you really afford to be that picky, anyway? ?",http://reddit.com/r/pics/comments/4c3z3f/c/d1f7osy,3854,1
5212,pics,,22,https://www.reddit.com/r/pics/comments/4cqm1v,Found this skull while walking through campus today,In the shadow I can see a guy holding a bouquet of flowers in front of him while yelling ,http://reddit.com/r/pics/comments/4cqm1v/c/d1kk2mj,4469,4
5213,pics,,149,https://www.reddit.com/r/pics/comments/4by0ba,This looks somewhat familiar,"Did you open it and see if there's a key? If there is, I'm pretty sure it will fit the door of a girl you've got a pretty good shot with.",http://reddit.com/r/pics/comments/4by0ba/c/d1ddkhs,1311,1
5221,pics,,148,https://www.reddit.com/r/pics/comments/48gdg9,An episode of 'Tom and Jerry' is unfolding in front of me...,Unfortunately the ending was far more graphic than I remembered.,http://reddit.com/r/pics/comments/48gdg9/c/d0jb9t0,4419,1
5224,pics,,61,https://www.reddit.com/r/pics/comments/4b4vwx,Added some color to my closet.,I dream to one day have an end table and lamp in my closet.,http://reddit.com/r/pics/comments/4b4vwx/c/d1655um,1380,1
5231,pics,,57,https://www.reddit.com/r/pics/comments/48myoe,My father-in-law bought this new massage chair that looks exactly like a big black d*ck,"
Edit: look at the guy history, he tried to post it yesterday and comment on the another thread about said chair.",http://reddit.com/r/pics/comments/48myoe/c/d0l711s,3448,1
5236,pics,,20,https://www.reddit.com/r/pics/comments/4b3wuu,My cat was not happy that I disposed of the mole he just left at the back door. Face of Betrayal.,I did feel bad. He was so proud; you'd have thought his balls grew back!,http://reddit.com/r/pics/comments/4b3wuu/c/d15zvbt,655,1
5237,pics,,32,https://www.reddit.com/r/pics/comments/4ckr2y,"One big reason I'm excited for this December's ""Rogue One: A Star Wars Story""",Coming to art house theaters near you: Brogue One.,http://reddit.com/r/pics/comments/4ckr2y/c/d1j46aw,386,0
5241,pics,,90,https://www.reddit.com/r/pics/comments/4bywu9,PSA to parents: The skatepark is not a jungle gym.,that was the most solid undeserved right jab ever.,http://reddit.com/r/pics/comments/4bywu9/c/d1dme6x,639,1
5250,pics,,23,https://www.reddit.com/r/pics/comments/48sub7,Waterslide in Dubai,The guy who edited that video is an idiot.,http://reddit.com/r/pics/comments/48sub7/c/d0msa6o,153,1
5266,pics,,25,https://www.reddit.com/r/pics/comments/49cmgd,"An abandoned steel mill in Bethlehem, PA",I was getting a Midgar vibe from it.,http://reddit.com/r/pics/comments/49cmgd/c/d0qui68,3343,1
5269,pics,,150,https://www.reddit.com/r/pics/comments/48ze5w,Growing Up Together,"By raising them with a domesticated dog, the cheetah will just see that the dog isn't worried, and so the cheetah stays calm :)",http://reddit.com/r/pics/comments/48ze5w/c/d0o5vnk,2410,1
5278,pics,,35,https://www.reddit.com/r/pics/comments/4be9sj,I took a picture through my sunglasses at the beach with my phone. It turned out better than I expected.,Repost spam account.,http://reddit.com/r/pics/comments/4be9sj/c/d18cbfr,183,1
5307,pics,,21,https://www.reddit.com/r/pics/comments/49o1hm,Abandoned Aquarium,"agreed, the pictures are fine. photo snobs",http://reddit.com/r/pics/comments/49o1hm/c/d0tkhd6,5676,1
5325,pics,,31,https://www.reddit.com/r/pics/comments/49nktc,"Shut up baby, i know it!",Please tell me that cigar vents smoke.,http://reddit.com/r/pics/comments/49nktc/c/d0t8por,5031,5
5332,pics,,27,https://www.reddit.com/r/pics/comments/4chxn3,Interior of the 1985 Nissan CUE-X concept.,FTFY,http://reddit.com/r/pics/comments/4chxn3/c/d1id9o0,3091,1
5345,pics,,21,https://www.reddit.com/r/pics/comments/4bqvyl,My son had eye surgery to fix his crossed eyes. The result turned out amazingly.,... And torches. ,http://reddit.com/r/pics/comments/4bqvyl/c/d1bos2j,414,1
5360,pics,,30,https://www.reddit.com/r/pics/comments/4cql1b,The Wonders of Taxidermy,That is a meme that lived fast and died young. ,http://reddit.com/r/pics/comments/4cql1b/c/d1kw895,5045,1
5365,pics,,26,https://www.reddit.com/r/pics/comments/4bk5ox,This is why we wear helmets all the time...,This almost got to the point where he would piss his pants and forget who he is for a half hour after his wife revved up the microwave. ,http://reddit.com/r/pics/comments/4bk5ox/c/d19w8y1,4654,1
5372,pics,,87,https://www.reddit.com/r/pics/comments/49dzyu,Ridiculously photogenic smug owl.,"""Yes, rly.""",http://reddit.com/r/pics/comments/49dzyu/c/d0r2xbl,4255,1
5374,pics,,110,https://www.reddit.com/r/pics/comments/4acwq6,How's your Monday going?,Look what happened to me,http://reddit.com/r/pics/comments/4acwq6/c/d0zty9h,5106,0
5375,pics,,104,https://www.reddit.com/r/pics/comments/48vaek,"Hot pot stuck on carpet, how do I get it off?",http://imgur.com/UfycW6y,http://reddit.com/r/pics/comments/48vaek/c/d0mu0xr,177,1
5382,pics,,20,https://www.reddit.com/r/pics/comments/4cgv1o,Stunning Tattoo,"20k for a sleeve? I don't care how great the artist is, if you pay that much for a sleeve then you're paying for their name and not the art itself. ",http://reddit.com/r/pics/comments/4cgv1o/c/d1iitmk,2421,1
5385,pics,,26,https://www.reddit.com/r/pics/comments/4a3gaj,Thread,This and the Potomac piece are my favorites at the Renwick Gallery.,http://reddit.com/r/pics/comments/4a3gaj/c/d0x62cw,2167,1
5398,pics,,25,https://www.reddit.com/r/pics/comments/48z3zu,"Ordered some bootleg Marvel Lego minifigs from China, got this instead of Captain America.....",Wait are you saying they got your order reicht?,http://reddit.com/r/pics/comments/48z3zu/c/d0nrpi6,191,1
5402,pics,,20,https://www.reddit.com/r/pics/comments/49pued,My sister just opened her first store. She makes French Macarons. What do you think of the front?,The macarons should be hexagonal. ,http://reddit.com/r/pics/comments/49pued/c/d0u0y4w,2012,1
5420,pics,,24,https://www.reddit.com/r/pics/comments/4afhtr,If only there were a place to get affordable breast cancer screenings...,https://www.plannedparenthood.org/learn/womens-health/breast-cancer-screenings,http://reddit.com/r/pics/comments/4afhtr/c/d0zykwm,4499,1
5424,pics,,37,https://www.reddit.com/r/pics/comments/4b32w9,This is a potoo. He showed up at my neighbor's house and the enviromental police rescued him back into the wilderness," to make these look like real animals?""",http://reddit.com/r/pics/comments/4b32w9/c/d15oort,684,0
5434,pics,,38,https://www.reddit.com/r/pics/comments/4cb8o0,Tyler Perry's House,That depends on whether you're in a car or a plane.,http://reddit.com/r/pics/comments/4cb8o0/c/d1gl1nx,154,0
5436,pics,,39,https://www.reddit.com/r/pics/comments/4aex7g,"I entered a photography contest in school with this picture. The only rule was you had to have a dollar bill in the picture. I won first place with a fifty dollar prize, I'm proud of my work!",https://www.reddit.com/r/pics/comments/28fidm/i_entered_a_photography_contest_in_school_with/,http://reddit.com/r/pics/comments/4aex7g/c/d0zu9hh,2,3
5446,pics,,33,https://www.reddit.com/r/pics/comments/4bsoa2,Young Vervet Monkey plays the hide-and-seek game of his life,"(Apologies for accidentally deleting the first link, I'm on mobile).",http://reddit.com/r/pics/comments/4bsoa2/c/d1c2986,1183,1
5460,pics,,27,https://www.reddit.com/r/pics/comments/48ww0s,"Lady pulled out in front of me on my way to class. Took out her front, ran thru a light pole, and came to a stop on the median. RIP my car :'-(",Does this diagram help?,http://reddit.com/r/pics/comments/48ww0s/c/d0nhzpp,374,4
5461,pics,,22,https://www.reddit.com/r/pics/comments/499awz,Five generations,Y'all have kids when you were 15?,http://reddit.com/r/pics/comments/499awz/c/d0q0389,317,1
5463,pics,,251,https://www.reddit.com/r/pics/comments/4c6ae4,"Very identical to the late, Heath Ledger. I have to congratulate this guy on an amazing job ...",/r/TitleGore,http://reddit.com/r/pics/comments/4c6ae4/c/d1fpjij,4180,1
5466,pics,,158,https://www.reddit.com/r/pics/comments/4cclmv,Various foods cut in to perfect cubes,Everyone needs 3 square meals a day. ,http://reddit.com/r/pics/comments/4cclmv/c/d1gzncs,3816,1
5470,pics,,29,https://www.reddit.com/r/pics/comments/495svh,Prague at dusk,This was just reposted a few weeks ago... Now everyone's gonna come here and say it looks like bloodborne or various other games,http://reddit.com/r/pics/comments/495svh/c/d0pj6e3,4659,1
5481,pics,,71,https://www.reddit.com/r/pics/comments/48b86p,My wife went as Rey to our friends Oscar party,Gaaaaayyyy,http://reddit.com/r/pics/comments/48b86p/c/d0iw9by,4278,1
5483,pics,,20,https://www.reddit.com/r/pics/comments/4br4wd,West Australia Police just snapped this guy speeding...,That is not going to end well for him.  It's pretty sad actually.,http://reddit.com/r/pics/comments/4br4wd/c/d1bmiq5,226,1
