,subreddit,body,comment_score,self_url,title,comment,link,score,clusters
2,pics,,29,https://www.reddit.com/r/pics/comments/48jjpq,"My $2,000 TV Stand",does this advice apply to male or female students?,http://reddit.com/r/pics/comments/48jjpq/c/d0k4nol,3459,1
5,pics,,105,https://www.reddit.com/r/pics/comments/4cmo4y,Walmart selling cleaner next to juice drinks,/r/KenM,http://reddit.com/r/pics/comments/4cmo4y/c/d1jzgkn,6722,1
9,pics,,28,https://www.reddit.com/r/pics/comments/4b9w6x,THANK YOU REDDIT!!! You have changed my life :D,"I mean, it could've been 4chan. I heard he's been on the run for a while now..",http://reddit.com/r/pics/comments/4b9w6x/c/d17hilv,4597,1
19,pics,,44,https://www.reddit.com/r/pics/comments/4ci3ck,Rainbow lights installed inside railroad underpass built in the 1930's.,Can you send me some Good People IPA?,http://reddit.com/r/pics/comments/4ci3ck/c/d1iovqh,7044,0
33,pics,,64,https://www.reddit.com/r/pics/comments/497rjz,Time Square NYC,Definitely shopped. That plane would be HUUUUUUUGE,http://reddit.com/r/pics/comments/497rjz/c/d0pnyyi,5661,1
39,pics,,50,https://www.reddit.com/r/pics/comments/4bwyv8,Excellent family cosplay,Tina is spooky accurate.  ,http://reddit.com/r/pics/comments/4bwyv8/c/d1d5u0j,4994,1
43,pics,,397,https://www.reddit.com/r/pics/comments/4aso3v,LAPD Officer Kristina Tudor ran & finished the LA Marathon in full tactical uniform for charity,Good thing she's used to chafing bad guys all the time.,http://reddit.com/r/pics/comments/4aso3v/c/d13bhnk,7669,1
46,pics,,38,https://www.reddit.com/r/pics/comments/4acqrn,Rainbow Mountains of Peru,Still awesome though... ,http://reddit.com/r/pics/comments/4acqrn/c/d0zhff3,5645,1
47,pics,,53,https://www.reddit.com/r/pics/comments/4b7e4o,My tall and skinny cactus [OC],Cavendish bananas,http://reddit.com/r/pics/comments/4b7e4o/c/d16v0xs,5370,1
53,pics,,62,https://www.reddit.com/r/pics/comments/4ajs0e,"Peter Dinklage, in a strip club, hoolahooping",lol,http://reddit.com/r/pics/comments/4ajs0e/c/d10x8n1,5049,1
55,pics,,98,https://www.reddit.com/r/pics/comments/4brndp,Hillary for...huh?,I heard she pays Illegal Immigrants in front of Home Depot to choke her in the shower ,http://reddit.com/r/pics/comments/4brndp/c/d1c7hdm,3565,1
56,pics,,29,https://www.reddit.com/r/pics/comments/4981az,"My camera refocused right before I took a picture of some broken glass, and it focused on the trees reflection.",Why does this have 5000+ upvotes?,http://reddit.com/r/pics/comments/4981az/c/d0q0rgi,5801,1
60,pics,,1667,https://www.reddit.com/r/pics/comments/494c7u,Donald Trump makes members of his Orlando crowd raise their right hands and swear to vote in the primary,"""Wig Heil!""",http://reddit.com/r/pics/comments/494c7u/c/d0ox3b3,4412,1
71,pics,,277,https://www.reddit.com/r/pics/comments/4cfmqr,Got transferred to a a new Mcdonalds store. First thing i did was scrub their vats.,When i was 16 i did my chefing apprentiship. I loved cooking and how it made people come together and be happy. But in my 3rd year i decided to expand my knowledge and go into fine dining the hed chef was horrible. I tried to push on because i had herd of so many stories about chefs like him but it wasnt worth it. Ive always wanted to get back into but idk,http://reddit.com/r/pics/comments/4cfmqr/c/d1i4vtx,6211,1
79,pics,,30,https://www.reddit.com/r/pics/comments/4alkyd,"My dad received this in the mail anonymously, what should we do reddit. (Details in comments)",Go immediately to the police.,http://reddit.com/r/pics/comments/4alkyd/c/d11fkpp,73,1
80,pics,,23,https://www.reddit.com/r/pics/comments/49ad0p,My dog Sasha was stolen out of my yard today. I already miss you sweet girl.,Ended up walking the street asking neighbors. One claims she saw a guy open my gate and put her in his car. All i know is that i better not find the person.,http://reddit.com/r/pics/comments/49ad0p/c/d0qa0fc,166,4
82,pics,,537,https://www.reddit.com/r/pics/comments/4cnope,"Since the other Google Trekker photo had so much interest, here's my stupid face wearing one. Feel free to ask questions.","The other post said it weighed around 50 pounds, but I'd say it was closer to 70. It was attached to a pack with an internal frame and it was balanced really well, so once it was on and the hip straps were adjusted it was surprisingly comfortable. ",http://reddit.com/r/pics/comments/4cnope/c/d1jxwhi,5388,0
84,pics,,54,https://www.reddit.com/r/pics/comments/4azp6z,They told me not to waste time on 2 liberal arts degrees. Today it feels worth it.,Goblin War by Jim C. Hines is definitely what came to mind when I saw the OP.,http://reddit.com/r/pics/comments/4azp6z/c/d15930x,2992,8
90,pics,,22,https://www.reddit.com/r/pics/comments/494dk9,Age 15,.,http://reddit.com/r/pics/comments/494dk9/c/d0pa4n7,5094,1
101,pics,,32,https://www.reddit.com/r/pics/comments/495smn,"To the greatest team of scientist on television who taught us failure is always an option, Thank you for 14 years of Mythbusting.","probably the typical ""omg she's so hot"" that always pops up in myth buster threads.  ",http://reddit.com/r/pics/comments/495smn/c/d0piysr,4509,1
107,pics,,55,https://www.reddit.com/r/pics/comments/4b2ris,"People have always said that I look exactly like my mum when she was younger, apparently they were right...",/r/wincest,http://reddit.com/r/pics/comments/4b2ris/c/d15l8jl,5284,5
111,pics,,136,https://www.reddit.com/r/pics/comments/4c5xi4,Chinese explorer Zheng He's ship compared to Christopher Columbus' Santa Maria. Both lived and sailed at the same time., in Zheng He's fleets.,http://reddit.com/r/pics/comments/4c5xi4/c/d1fe5v2,5178,0
116,pics,,76,https://www.reddit.com/r/pics/comments/4a8auu,"New carnival float in Düsseldorf, Germany today.",#3 isn't even going to win his home state. ,http://reddit.com/r/pics/comments/4a8auu/c/d0y8tng,3460,4
122,pics,,40,https://www.reddit.com/r/pics/comments/48xsv1,Ever see a spray-on bed liner paint job?,That's a pretty slick vw!  ,http://reddit.com/r/pics/comments/48xsv1/c/d0nktpo,5575,1
123,pics,,39,https://www.reddit.com/r/pics/comments/4bwp6s,Who should I vote for?,"I thoroughly enjoy the fact that this video was posted by someone by the name of ""Aryan wisdom"".",http://reddit.com/r/pics/comments/4bwp6s/c/d1dbyup,3805,1
131,pics,,30,https://www.reddit.com/r/pics/comments/4b83h4,"For 6 years I tried to out-drink everyone, I'm now 1.5 years sober and happy letting others take that role"," everyone loses their goddamn mind and gets really angry. but this? no 'lol you fucking alcoholic"" no ""this isn't a weight loss sub"" etc. weird. congrats btw ",http://reddit.com/r/pics/comments/4b83h4/c/d174w3a,3620,1
136,pics,,43,https://www.reddit.com/r/pics/comments/49evha,We raised 7 hens from chicks and they finally started laying. The different breeds produce different colored eggshells.," to do with Jesus or Christianity. It is a european heathen tradition that celebrates spring/fertility and got incorporated into the christian tradition just like the winter solstice/yultide became ""Jesus' Birthday"".",http://reddit.com/r/pics/comments/49evha/c/d0rd7oa,6727,7
142,pics,,31,https://www.reddit.com/r/pics/comments/4ajzfu,My sister in law is an illustrator for Archer. This is what she sent my husband for Christmas.,They will if you raise them right.,http://reddit.com/r/pics/comments/4ajzfu/c/d11a300,6039,1
148,pics,,76,https://www.reddit.com/r/pics/comments/4cdaf5,So I came across this in Tokyo yesterday ...,Eat the booty like groceries ,http://reddit.com/r/pics/comments/4cdaf5/c/d1h62vw,5044,1
153,pics,,451,https://www.reddit.com/r/pics/comments/4bzqby,A guy who helped run a gaming server asked all the people on it who the most beautiful woman in their country was. The answers.,"Since some of the countries are repeated, I'm guessing they've just listed every single answer rather than a consensus answer for each country. She could well be one guy's preference, or the guy might have been Aboriginal himself. She's very beautiful, but having spent a good amount of time in Australia, I too find it difficult to believe that the average Aussie guy would pay her any attention due to her race.",http://reddit.com/r/pics/comments/4bzqby/c/d1dvay7,4362,1
155,pics,,35,https://www.reddit.com/r/pics/comments/498gsu,My $20 bill,"Yeah, but at the time ""all men"" really meant wealthy, land owning men. ",http://reddit.com/r/pics/comments/498gsu/c/d0qam9q,4521,1
158,pics,,58,https://www.reddit.com/r/pics/comments/49rcb9,"This is Guanabara Bay, where olympic athletes will compete in Rio 2016. Rio governor said the water is clean.","According to your definition, Somalia is also a second world country. ",http://reddit.com/r/pics/comments/49rcb9/c/d0ubl6m,7963,1
162,pics,,22,https://www.reddit.com/r/pics/comments/4b50gp,We need this man now more than ever,"You described yourself as a Left Libertarian. What do you take that to mean, I suppose it's possible that describes me!",http://reddit.com/r/pics/comments/4b50gp/c/d16i18j,3625,1
163,pics,,25,https://www.reddit.com/r/pics/comments/4bar8e,"My boyfriend refused to believe I had met the Homeward Bound animals, but I think this will settle that argument.","Nope. Every time Paul Rudd goes on Conan,  he tells him that he brought a clip from his new movie and instead plays a clip from Mac and Me. ",http://reddit.com/r/pics/comments/4bar8e/c/d17mi11,5403,1
164,pics,,23,https://www.reddit.com/r/pics/comments/4bzm7e,Chris Christie pouring a bag of M&Ms into a bigger bag of M&Ms.,When have we not been TMZ? I mean some jokes here are shittier than TMZ itself.,http://reddit.com/r/pics/comments/4bzm7e/c/d1dzgpc,3421,1
172,pics,,35,https://www.reddit.com/r/pics/comments/4b3b0b,"If pigeons had eyes on the front of their heads, rather than the side.",Goodfeathers,http://reddit.com/r/pics/comments/4b3b0b/c/d15p2d1,5452,1
173,pics,,95,https://www.reddit.com/r/pics/comments/49wf4f,"My father and I, 29 years apart",its funny because that's exactly what he did,http://reddit.com/r/pics/comments/49wf4f/c/d0vwv34,4801,1
183,pics,,29,https://www.reddit.com/r/pics/comments/4c15rv,"A colorized image of the first underwater nuclear explosion, Test ""Baker"". The large black vertical object in the right side of the shockwave is the 36,000 ton aircraft carrier ""Saratoga"" being blown out of the water.",At 13 miles you get a perfect medium rare.,http://reddit.com/r/pics/comments/4c15rv/c/d1edned,2759,1
188,pics,,45,https://www.reddit.com/r/pics/comments/48ximo,The Complete and Horrifying SimonGangi Pokecollection,"Mr. Mime still creepy as fuck, I see.",http://reddit.com/r/pics/comments/48ximo/c/d0njog2,675,1
201,pics,,35,https://www.reddit.com/r/pics/comments/4a9sxu,A monument for the many,http://www.pbs.org/art21/images/do-ho-suh/public-figures-1998-1999,http://reddit.com/r/pics/comments/4a9sxu/c/d0yjful,6661,1
207,pics,,21,https://www.reddit.com/r/pics/comments/49p1mi,I want to believe,What is this Silence you speak of? I've never seen them,http://reddit.com/r/pics/comments/49p1mi/c/d0ts1ml,6559,1
212,pics,,221,https://www.reddit.com/r/pics/comments/4cgetp,My first cosplay self-portraiture — peasant Cinderella!,Glad we've worked these important issues out.,http://reddit.com/r/pics/comments/4cgetp/c/d1i6e96,4277,1
213,pics,,2657,https://www.reddit.com/r/pics/comments/4b9gtr,First time in Cuba. Thanks Obama.,Cuba has Reddit?,http://reddit.com/r/pics/comments/4b9gtr/c/d1761t5,5989,1
218,pics,,43,https://www.reddit.com/r/pics/comments/48zp5c,Do you want me to buy nothing? This is how you make me buy nothing.,Freedom costs a buck 'o five.,http://reddit.com/r/pics/comments/48zp5c/c/d0o2zrk,2381,1
221,pics,,86,https://www.reddit.com/r/pics/comments/4aldo9,Dogs: 0 Porcupine: 1,"The one at the back looks like he loved it. I bet he's like, ""Let's totally do that again"", while the other is like ""fuck that.""",http://reddit.com/r/pics/comments/4aldo9/c/d11e40h,1203,1
225,pics,,146,https://www.reddit.com/r/pics/comments/4aahtj,An all-female crew lands an airliner into a country they're not allowed to drive in.,Edit: Any plane is shitty in peasant class. But look at the cockpit! And the wing flex! And the engines! And the composite fuselage! And the lower pressurization altitude! Looks like something out of science fiction! ,http://reddit.com/r/pics/comments/4aahtj/c/d0yw7to,5857,1
238,pics,,87,https://www.reddit.com/r/pics/comments/4avzqc,There's an irony in ignoring your college professor's lecture to play a game where you serve fast-food to people for fun,It's like Game of Thrones roleplaying but without the boobs ,http://reddit.com/r/pics/comments/4avzqc/c/d147zi1,11986,0
242,pics,,50,https://www.reddit.com/r/pics/comments/494ehp,A picture I took at a Trump rally.,http://i.imgur.com/Vhm3HHT.jpg,http://reddit.com/r/pics/comments/494ehp/c/d0pgweb,3511,1
245,pics,,22,https://www.reddit.com/r/pics/comments/4chh9n,A friend just came home to find the cleaner he hired asleep on his bed....for the last 6 hours.,Yeah but he's taken your drugs man ,http://reddit.com/r/pics/comments/4chh9n/c/d1iwgrk,3925,1
256,pics,,110,https://www.reddit.com/r/pics/comments/49t1go,1981 Lego ad,"I don't see how LEGO Friends damages anything, it did more to make LEGO an accepted toy for females than anything else LEGO had attempted before that and LEGO still tries to market generic sets to girls as well.",http://reddit.com/r/pics/comments/49t1go/c/d0uugzx,5699,1
258,pics,,56,https://www.reddit.com/r/pics/comments/4b3sdz,This is my friend at age 13. He looked exactly like Natalie Portman.,"It is more of a promotion since we cannot legally advertise for a mob acting agaisnt a certain op at our Emporium. Our pitchforks are up to 70% off when you use the promotion code ""NataLIE"" at check out. ",http://reddit.com/r/pics/comments/4b3sdz/c/d162abl,4460,1
265,pics,,253,https://www.reddit.com/r/pics/comments/4asv6h,The difference between an Alligator Snapping Turtle vs Common Snapping Turtle," that shows a few different ways you can help them across the road. Always move them in the direction they were initially going, or else they'll just turn around and try to cross again.",http://reddit.com/r/pics/comments/4asv6h/c/d13gx54,7082,1
266,pics,,86,https://www.reddit.com/r/pics/comments/4c7pp7,Red Tailed Hawk,I know that's you Tobias.,http://reddit.com/r/pics/comments/4c7pp7/c/d1fqndp,1822,1
277,pics,,99,https://www.reddit.com/r/pics/comments/4a0689,Mike Myers has gone full Steve Martin.,"If it's a severed head, I'm going to be very upset.",http://reddit.com/r/pics/comments/4a0689/c/d0wkc1u,6163,1
278,pics,,70,https://www.reddit.com/r/pics/comments/4cgjdy,SpaceX suits look like they come straight from a scifi movie,"When you wanna go to mars, but also be a French DJ.",http://reddit.com/r/pics/comments/4cgjdy/c/d1icnxm,2558,1
279,pics,,50,https://www.reddit.com/r/pics/comments/4bnrs7,Found out my girlfriend is cheating on me. Giving her this card tonight at my birthday dinner.,I hope he wasn't planning on buying her dinner for his birthday.,http://reddit.com/r/pics/comments/4bnrs7/c/d1avsno,4407,1
280,pics,,41,https://www.reddit.com/r/pics/comments/4cruas,My girlfriend put a bird feeder on our deck. This bastard ate himself to sleep.,"When my grandfather was in his prime he would get so angry at the squirrels that he would hook up a wire to the bird feeder from the kitchen light switch (he was an electrician). He would sit there for hours and wait for a squirrel to try to climb up it, and flip the switch. The squirrels would literally FLY, like five feet straight up. I felt a little bad but it was one of the funniest things I've ever seen. ",http://reddit.com/r/pics/comments/4cruas/c/d1l3bsq,7690,1
284,pics,,27,https://www.reddit.com/r/pics/comments/49jybn,"Lest we forget, happy women's day to all the brave heroines out there battling ISIS",First person shooter franchises.,http://reddit.com/r/pics/comments/49jybn/c/d0spzpe,4649,7
285,pics,,64,https://www.reddit.com/r/pics/comments/4cbnsm,"Tectonic activity pushed a shoreline vertical, creating a wall covered in dinosaur footprints.","They did (and probably still do) but a lot of fans like reading it the ""original"" way, from right to left. So most fan translations and publications tend to be made un-flipped. ",http://reddit.com/r/pics/comments/4cbnsm/c/d1h17i6,7519,1
286,pics,,24,https://www.reddit.com/r/pics/comments/48twuw,"Hillary be like, ""I wanna end corruption in Wall Street.""","
or sending dick pics to people who tell him off  ",http://reddit.com/r/pics/comments/48twuw/c/d0mpfux,2751,8
293,pics,,154,https://www.reddit.com/r/pics/comments/4c79g7,The grand canyon lit only by lightning,http://imgur.com/zim4a65,http://reddit.com/r/pics/comments/4c79g7/c/d1fwa96,6376,1
310,pics,,26,https://www.reddit.com/r/pics/comments/4bfi84,My friend was in the middle of a photoshoot when the photographer's bulldog woke up from a nap,She's a tall woman.,http://reddit.com/r/pics/comments/4bfi84/c/d18v4ha,4562,0
317,pics,,37,https://www.reddit.com/r/pics/comments/4c578y,"Life's photos from the very first Miss Universe pageant, 1952","And she bagged a Filipino millionaire. A young one, and relatively tall. Not bad work all told. ",http://reddit.com/r/pics/comments/4c578y/c/d1faajo,4742,0
324,pics,,72,https://www.reddit.com/r/pics/comments/48lvnl,Un café...,More like nobody understands anybody! Everybody lose!,http://reddit.com/r/pics/comments/48lvnl/c/d0kr3uf,4863,1
332,pics,,194,https://www.reddit.com/r/pics/comments/4bwlfn,Rare 'Ili Pika rabbit has been photographed for the first time in 20 years.,yup,http://reddit.com/r/pics/comments/4bwlfn/c/d1dab5x,8361,1
350,pics,,44,https://www.reddit.com/r/pics/comments/48t6bw,Newly discovered image by the Chicago Reader of Bernie Sanders chained to protesters,Bill was the first black president.,http://reddit.com/r/pics/comments/48t6bw/c/d0mlohy,4376,1
382,pics,,98,https://www.reddit.com/r/pics/comments/4c14m5,My brother went as Jon Snow-White for Purim (Jewish halloween),I think he kinda looks like a jewish Macklemore.,http://reddit.com/r/pics/comments/4c14m5/c/d1e8yst,4684,1
388,pics,,59,https://www.reddit.com/r/pics/comments/49yoh6,I've been stopping strangers on the streets of NYC and asking them to pose for a quick photo. This is one of my favorites from this week.,"Hahah, glad I could make that happen for you buddy",http://reddit.com/r/pics/comments/49yoh6/c/d0w2gni,5081,8
389,pics,,42,https://www.reddit.com/r/pics/comments/49ctvk,Transparent Bubble Tent Lets You Sleep Underneath The Stars,bears get to see their meal before ripping into your tent!,http://reddit.com/r/pics/comments/49ctvk/c/d0qrwgq,324,1
400,pics,,153,https://www.reddit.com/r/pics/comments/49u5rd,Two boys making a trade (1962),"""Gettin real tired of your colonial bullshit""",http://reddit.com/r/pics/comments/49u5rd/c/d0v6r8n,5953,1
403,pics,,44,https://www.reddit.com/r/pics/comments/48t5iu,If you do this then fuck you!,"I'm not saying this is right, but there's no cart corrals in the pic. At least they're all in one place.",http://reddit.com/r/pics/comments/48t5iu/c/d0mbhxw,157,2
417,pics,,128,https://www.reddit.com/r/pics/comments/4ch5cs,So this happened today...,Front lines of what? All that trench warfare in Afghanistan? ,http://reddit.com/r/pics/comments/4ch5cs/c/d1iiinn,4689,4
431,pics,,22,https://www.reddit.com/r/pics/comments/49adcx,This is my dog. He's not dead yet so you probably won't like him.,Alive dogs are my favorite dogs! (this is likely a sentiment not unique to me),http://reddit.com/r/pics/comments/49adcx/c/d0qgzhi,2393,5
436,pics,,128,https://www.reddit.com/r/pics/comments/4a87lk,Beautiful big cat in the snow.,"Yeah, but, like, it's what you do with it that matters.",http://reddit.com/r/pics/comments/4a87lk/c/d0y6pja,4718,1
439,pics,,22,https://www.reddit.com/r/pics/comments/48nvds,Mount Fuji,I didn't come out the pussy drawing fuckin' Mozart,http://reddit.com/r/pics/comments/48nvds/c/d0ltvd0,7078,1
441,pics,,20,https://www.reddit.com/r/pics/comments/4bws23,Bath Time!,Oh. My. Gawd. That's freaking cute.,http://reddit.com/r/pics/comments/4bws23/c/d1d2awr,2076,1
443,pics,,30,https://www.reddit.com/r/pics/comments/49x0fn,Justin Trudeau and Ryan Reynolds at the White House State Dinner,have a suggestion,http://reddit.com/r/pics/comments/49x0fn/c/d0vtivr,4377,1
446,pics,,155,https://www.reddit.com/r/pics/comments/49nyr0,Meanwhile on the Subway,Jared's Links? ,http://reddit.com/r/pics/comments/49nyr0/c/d0tc01i,5957,9
447,pics,,22,https://www.reddit.com/r/pics/comments/4c5tx3,Mont Saint-Michel under the stars,Decent video tour of this location,http://reddit.com/r/pics/comments/4c5tx3/c/d1fgtd9,6209,1
453,pics,,51,https://www.reddit.com/r/pics/comments/4ckhmb,Getting a proper blowjob sitting down,/r/nocontext,http://reddit.com/r/pics/comments/4ckhmb/c/d1j3ylv,3482,1
462,pics,,983,https://www.reddit.com/r/pics/comments/48gwhp,Mr.Deadpool showing some wife-love,Headpool,http://reddit.com/r/pics/comments/48gwhp/c/d0jqy8z,3912,1
468,pics,,22,https://www.reddit.com/r/pics/comments/4bic72,"I heard you guys were interested in Whittier, AK, the ""Town under one roof."" Here are some pics from my visit.","Screw you, I'm thanking you NOW.",http://reddit.com/r/pics/comments/4bic72/c/d19nqop,7401,1
469,pics,,23,https://www.reddit.com/r/pics/comments/4997sw,"There is one McD's left in the US that offers pizza, in Pomeroy, OH. This is what that pizza looks like.",.,http://reddit.com/r/pics/comments/4997sw/c/d0q83mb,5829,0
485,pics,,37,https://www.reddit.com/r/pics/comments/494qhi,Caught this off the coast of Nova Scotia,Why? I successfully repressed that horrific memory. And now you've gone and done this.,http://reddit.com/r/pics/comments/494qhi/c/d0pagz2,5155,1
489,pics,,155,https://www.reddit.com/r/pics/comments/4co1hv,Last veteran of his WWII battle group marching alone in Memorial Day Parade.,"This song reminds me of the album my great grandfather made of the photos he took using a camera he found on a dead German whilst in Egypt, Jerusalem, Turkey, then the photos stopped when he got to the European theatre. There's a bunch of pictures of Gallipoli, it's kind of amazing how thus kept their spirits up. He was 19 when he got shipped away kinda fucked up thing for a kid to go through. ",http://reddit.com/r/pics/comments/4co1hv/c/d1k5954,5755,7
492,pics,,49,https://www.reddit.com/r/pics/comments/4b2jdd,20 ft tall graffiti mural of Kanye west kissing himself.,But this one isn't,http://reddit.com/r/pics/comments/4b2jdd/c/d15mx18,5823,1
497,pics,,427,https://www.reddit.com/r/pics/comments/48zo8h,An $8 million Monet painting after a man punched it.,Yeah Monet doesn't grow on trees ,http://reddit.com/r/pics/comments/48zo8h/c/d0ognb5,3156,1
501,pics,,25,https://www.reddit.com/r/pics/comments/48dknb,The snow was very geometric when I went skiing,I like people that explain jokes because I never get them otherwise. Keep it up!,http://reddit.com/r/pics/comments/48dknb/c/d0jbmwn,5786,1
510,pics,,69,https://www.reddit.com/r/pics/comments/4bw5j8,An American Veteran committed suicide recently by setting himself on fire in front of his local Veterans Affairs building in New Jersey.,I hope that helps even a little bit. ,http://reddit.com/r/pics/comments/4bw5j8/c/d1d2b7f,6965,1
519,pics,,28,https://www.reddit.com/r/pics/comments/49dazf,These eagles look like they're hatching a plan,"""Dude, you see that guy over there with the DUDE DON'T LOOK RIGHT NOW JESUS play it cool man.""",http://reddit.com/r/pics/comments/49dazf/c/d0qw48h,5127,1
521,pics,,30,https://www.reddit.com/r/pics/comments/49u5mi,"Current march in Mexico City against the government, taken in the Zocalo. Bring awareness to our cause, please.",Yup,http://reddit.com/r/pics/comments/49u5mi/c/d0v1r6h,1365,1
530,pics,,25,https://www.reddit.com/r/pics/comments/4adtk4,This fucking kid..,The kind of parents that let their kids do this without noticing are the kind of parents that will throw a fit and try to have to kicked off the plane for flicking their kid's fingers. Not a great suggestion ,http://reddit.com/r/pics/comments/4adtk4/c/d0zpcoh,4829,2
531,pics,,192,https://www.reddit.com/r/pics/comments/4aeecr,Body scans of women at 250 and 120 pounds,The ankles are so much different. ,http://reddit.com/r/pics/comments/4aeecr/c/d0zpy94,5104,1
534,pics,,24,https://www.reddit.com/r/pics/comments/4bxzs8,"If you do this, go fuck yourself you stupid asshole",You can tell by his little hand,http://reddit.com/r/pics/comments/4bxzs8/c/d1dj1t4,4233,2
538,pics,,252,https://www.reddit.com/r/pics/comments/4catbu,A Polar Bear and her Cub,Time to go.,http://reddit.com/r/pics/comments/4catbu/c/d1guauq,5763,1
550,pics,,21,https://www.reddit.com/r/pics/comments/4c2vb8,The Oval Office before a new president personalizes it,http://abcnews.go.com/Politics/story?id=121856&page=1,http://reddit.com/r/pics/comments/4c2vb8/c/d1eusij,6549,1
552,pics,,22,https://www.reddit.com/r/pics/comments/48irzy,I learned how to work better today on my way to work . . . .,I agree with akjoltoy. It was readable the way they did it. It doesn't look like a huge wall of text but more like a list. Not sure why you would mention kerning when it's clearly hand drawn...,http://reddit.com/r/pics/comments/48irzy/c/d0k64kt,5400,4
554,pics,,36,https://www.reddit.com/r/pics/comments/4b59om,This guy refused to give up the seat next to him because he didn't want to get his bags dirty. Then I read his slippers...,Nobster,http://reddit.com/r/pics/comments/4b59om/c/d16bpbp,4820,5
565,pics,,21,https://www.reddit.com/r/pics/comments/492gex,Pit bull and Chihuahua adopted together,The little one is named Quatto.,http://reddit.com/r/pics/comments/492gex/c/d0ojvcc,949,1
570,pics,,28,https://www.reddit.com/r/pics/comments/4c0wfq,How most europeans view the presidential election...,Except that isn't true at all,http://reddit.com/r/pics/comments/4c0wfq/c/d1eaj1r,2591,1
