,subreddit,body,comment_score,self_url,title,comment,link,score,clusters
6776,pics,,68,https://www.reddit.com/r/pics/comments/4bjtyw,A vomit bag on a plane headed for Iceland,"Aisle or isle? I mean, if you can smell the cologne all the way from an island, that'd probably make me puke too. ",http://reddit.com/r/pics/comments/4bjtyw/c/d19rd65,1273,1
6780,pics,,84,https://www.reddit.com/r/pics/comments/48vjjn,Diver kneels under sunken Russian destroyer, The atmosphere is amazing.,http://reddit.com/r/pics/comments/48vjjn/c/d0n57in,3632,1
6791,pics,,26,https://www.reddit.com/r/pics/comments/4a1w3n,Took my roommates new head shot.,Edit: a number,http://reddit.com/r/pics/comments/4a1w3n/c/d0ws5to,3899,1
6795,pics,,33,https://www.reddit.com/r/pics/comments/48pih2,Found Saul Goodman himself in my mom's old yearbook.,http://i.imgur.com/ech5JSb.png,http://reddit.com/r/pics/comments/48pih2/c/d0lx2ou,1217,0
6800,pics,,22,https://www.reddit.com/r/pics/comments/4bcnfv,Cleaning the turtle,aaahhh... a... yup,http://reddit.com/r/pics/comments/4bcnfv/c/d18o6mq,5208,1
6837,pics,,32,https://www.reddit.com/r/pics/comments/4a3ner,Devil in a Blue Dress,  to post on.,http://reddit.com/r/pics/comments/4a3ner/c/d0xvvug,66,1
6839,pics,,37,https://www.reddit.com/r/pics/comments/4bqrva,"Perfect Shot (Russia, Winter 2016)",The person that took the picture got run over by a train. (No time for post shot work).,http://reddit.com/r/pics/comments/4bqrva/c/d1bm59v,2636,1
6841,pics,,68,https://www.reddit.com/r/pics/comments/49u4ag,16 year old Arnold Schwarzenegger at his first bodybuilding competition.,16 year old guitar player at his first homosexual awakening.,http://reddit.com/r/pics/comments/49u4ag/c/d0uuyhi,438,1
6842,pics,,21,https://www.reddit.com/r/pics/comments/4ae1da,"The teacher asked for a 16 line poem, this is what this kid turned in....","Damn, that disclaimer turned it into a 17 line poem.",http://reddit.com/r/pics/comments/4ae1da/c/d0zksqg,830,1
6851,pics,,89,https://www.reddit.com/r/pics/comments/4bd426,My brother made a galaxy turtle with a UV shell and I took forever putting this collage together. Enjoy!,"Holy shit. Inter-galactic turtles are a thing? My life is complete. On a serious note, this is some seriously cool looking stuff. Your brother has skill.",http://reddit.com/r/pics/comments/4bd426/c/d181c0n,4189,1
6857,pics,,20,https://www.reddit.com/r/pics/comments/4bhp2o,8 lives remaining...,Like he's just so happy to be loved on and comforted. ,http://reddit.com/r/pics/comments/4bhp2o/c/d19cp2m,694,1
6869,pics,,22,https://www.reddit.com/r/pics/comments/49lsih,A few months ago I decided to practice drawing every day. This is a drawing I started today.,http://i.imgur.com/R9Mu6Ly.jpg,http://reddit.com/r/pics/comments/49lsih/c/d0sv7uc,537,7
6872,pics,,71,https://www.reddit.com/r/pics/comments/4blrsz,Geometric Sandcastle,This is reminiscent of Art Vandelay's early work,http://reddit.com/r/pics/comments/4blrsz/c/d1ab496,6107,1
6875,pics,,27,https://www.reddit.com/r/pics/comments/4b9q02,...noticed this was sewn onto the inside lining of my dad's fighter pilot jacket," says $50-$250 during WWII, $100,000 in the 90's for helping an entire B-29 crew. I saw elsewhere that now it's around $500,000, but the amounts and actual use are now classified.",http://reddit.com/r/pics/comments/4b9q02/c/d179qa7,610,0
6880,pics,,61,https://www.reddit.com/r/pics/comments/4932y2,Volcano in Ethiopia burns bright blue,That volcano just blue itself.,http://reddit.com/r/pics/comments/4932y2/c/d0on3p6,3675,1
6883,pics,,32,https://www.reddit.com/r/pics/comments/48ytj2,Buddy of mine shot this...Thought I would share.,Isn't that the hit man hotel that John Wick checks into in the movie?,http://reddit.com/r/pics/comments/48ytj2/c/d0o31u9,2464,1
6905,pics,,54,https://www.reddit.com/r/pics/comments/48m11q,Welcome to paradise,As a super white person with very sensitive feet (I can't even walk on cement) that looks worse than walking on Legos.,http://reddit.com/r/pics/comments/48m11q/c/d0kwlmf,4602,1
6907,pics,,35,https://www.reddit.com/r/pics/comments/49zw3e,Millennium Falcon cake I just finished for my SO's birthday,It's a little Chewie,http://reddit.com/r/pics/comments/49zw3e/c/d0wa4kf,1435,0
6926,pics,,28,https://www.reddit.com/r/pics/comments/49pr01,Tiny vampire crab will stare into your soul,The only thing that stares into my soul are those fingernails. ,http://reddit.com/r/pics/comments/49pr01/c/d0twt75,1114,1
6935,pics,,27,https://www.reddit.com/r/pics/comments/4935yy,Norway provides some amazing views,I'm guessing Reine in Lofoten.,http://reddit.com/r/pics/comments/4935yy/c/d0oui1z,5741,1
6967,pics,,23,https://www.reddit.com/r/pics/comments/4adqod,Star Wars’ John Boyega dressed as Finn and surprised young children at a London hospital,is Matt Damon black now?,http://reddit.com/r/pics/comments/4adqod/c/d0zi74z,1842,8
6977,pics,,27,https://www.reddit.com/r/pics/comments/4avnax,My guitar after a show on Saturday,I think your guitar needs a maxipad,http://reddit.com/r/pics/comments/4avnax/c/d13w21h,19,1
6978,pics,,20,https://www.reddit.com/r/pics/comments/4aq0il,My dad unburied some kids old toys while fixing the driveway.,http://i.imgur.com/0NRHkvq.jpg,http://reddit.com/r/pics/comments/4aq0il/c/d12ruhw,757,1
6984,pics,,37,https://www.reddit.com/r/pics/comments/4adw0v,"A beach made of sea glass in Fort Bragg, CA",They just recently put up signs trying to enforce the fact you can't take the glass. In my opinion the state of California has larger issues then people taking glass from a former landfill that's now a tourist destination. Artifacts is a big stretch.,http://reddit.com/r/pics/comments/4adw0v/c/d0zz0fj,2282,1
6992,pics,,111,https://www.reddit.com/r/pics/comments/48x8nl,The price was her soul,well and her nose job.,http://reddit.com/r/pics/comments/48x8nl/c/d0nht4f,1095,1
7005,pics,,35,https://www.reddit.com/r/pics/comments/4brhp0,"Sound off like you've got a pair! Happy 72st birthday to R. Lee Ermey, the iconic Gunny!",Seventy two-st birthday! ,http://reddit.com/r/pics/comments/4brhp0/c/d1brwno,416,1
7013,pics,,21,https://www.reddit.com/r/pics/comments/48gryy,My 13 autistic son who is winning the battle against depression,"This isn't your son, fucking spammers.",http://reddit.com/r/pics/comments/48gryy/c/d0jea87,1,1
7014,pics,,23,https://www.reddit.com/r/pics/comments/4brltg,Mr. Trash Wheel got his googly eyes!,It is! Mr TW eats our garbage for us using the power of the sun.,http://reddit.com/r/pics/comments/4brltg/c/d1c16hn,674,1
7024,pics,,24,https://www.reddit.com/r/pics/comments/49kjx9,"Three Bridges Cave, Lebanon.",A view of all three bridges,http://reddit.com/r/pics/comments/49kjx9/c/d0swvw4,1026,1
7026,pics,"Hey all!We get a lot of feedback. Sometimes through reports, sometimes through modmail. All of this feedback is taken in, and talked about.Over the past few months, we have been getting a lot of feedback about the quality of the subreddit. Some people are not happy with the quality of the content on the subreddit, some people don't like the quality of the comments, etc, etc Solving this issue is no simple task. We brainstormed, came up with ideas, and voted on them. Nothing would really pass, something would come up, or another idea would just not be possible on the reddit platform.So we reached backWhat have other subreddits done to increase quality?Some tighten up on rulesSome create a poster whitelistMost became selfpost onlyAt that last point, when we finally came up with the idea it was clear then. The best way to increase the quality of /r/pics was to make it self-post only.Starting right now, /r/pics will only allow self posts. We are doing this to help stop and even reverse the decline of the sub. In addition, self promotion and spam has been a big problem lately. We have been absolutely flooded by run of the mill spam, as well as karma farmers - new accounts that steal comments and pictures in order to gain karma and sell their accounts. This kind of spam is incredibly hard to deal with. We decided along with self post only, we would just ban all links entirely.Thank you./r/pics mods",22,https://www.reddit.com/r/pics/comments/4cskn3,/r/pics is now text-only,"
Edit 3: shout out to tea bags",http://reddit.com/r/pics/comments/4cskn3/c/d1l312b,25,1
7060,pics,,26,https://www.reddit.com/r/pics/comments/4bgi1o,Damage inside Brussels Airport,"Islam is a religion that is oppressive at its best and violent beyond measure at its worst.Islam is so loving that it allows paedophilia. Islam shows its loving nature by oppressing its women. Islam is so peaceful that it's responsible for over 80% of major terrorist attacks world wide. Islam is so peaceful that its holy book commands muslims to kill people who dont agree with them. If you believe that Islam is loving and peaceful then please move to Syria, Saudi Arabia, Iran, Afghanistan, Iraq, Egyt etc... they would be happy to have you, and we would be happy to see you go.",http://reddit.com/r/pics/comments/4bgi1o/c/d198h0m,440,0
7066,pics,,106,https://www.reddit.com/r/pics/comments/4cfo6s,"One of my friends bears a striking resemblance to Jesus, and we were all having dinner on the last day of our week-long trip together, so it was only natural that we took this picture","You mean he looks like white Jesus,  which most of us can do by avoiding haircuts for a year.",http://reddit.com/r/pics/comments/4cfo6s/c/d1hpyr1,960,9
7070,pics,,69,https://www.reddit.com/r/pics/comments/4biu2u,My sister's first winter. This is in Norway by the way,.,http://reddit.com/r/pics/comments/4biu2u/c/d19j1zd,685,0
7075,pics,,41,https://www.reddit.com/r/pics/comments/49zpep,Elvish Presley,Elvish,http://reddit.com/r/pics/comments/49zpep/c/d0w96g7,3144,1
7087,pics,,24,https://www.reddit.com/r/pics/comments/49rivi,"A friend of all of us, spotted in Brooklyn, NY this morning",cringes,http://reddit.com/r/pics/comments/49rivi/c/d0u9vc0,139,1
7092,pics,,22,https://www.reddit.com/r/pics/comments/492dyi,This cat in our grooming salon yesterday.,http://imgur.com/2YNI494,http://reddit.com/r/pics/comments/492dyi/c/d0oj2bz,1338,1
7184,pics,,24,https://www.reddit.com/r/pics/comments/4c0lwj,Not sleeping yesterday was worth it for this picture,Reminds me of Alan Wake,http://reddit.com/r/pics/comments/4c0lwj/c/d1e53t5,743,1
7199,pics,,23,https://www.reddit.com/r/pics/comments/4crfp2,A cave house.,This is my dream. ,http://reddit.com/r/pics/comments/4crfp2/c/d1kwlrd,2840,1
7204,pics,,41,https://www.reddit.com/r/pics/comments/4ck3qa,Street art,At the wall.,http://reddit.com/r/pics/comments/4ck3qa/c/d1iwaxd,1698,8
7207,pics,,48,https://www.reddit.com/r/pics/comments/48pmiw,Let's all remember that while the media wants us to think America is in a race war with itself - acts like this prove otherwise.,Two random people helping each other doesn't say anything about a race war. Its an isolated event,http://reddit.com/r/pics/comments/48pmiw/c/d0loayp,463,1
7221,pics,,27,https://www.reddit.com/r/pics/comments/4a55il,"As a germophobe, this invention is much appreciated", is much appreciated,http://reddit.com/r/pics/comments/4a55il/c/d0xgy2w,290,1
7228,pics,,28,https://www.reddit.com/r/pics/comments/4boj6q,David Letterman's transition to becoming Santa,"""I don't know how many years on this Earth I got left, I'm gonna get real weird with it"".",http://reddit.com/r/pics/comments/4boj6q/c/d1b5028,492,0
7231,pics,,26,https://www.reddit.com/r/pics/comments/4cqj75,Shot this at an Indian wedding last week,Wannabe KenM,http://reddit.com/r/pics/comments/4cqj75/c/d1koopa,2499,3
7242,pics,,22,https://www.reddit.com/r/pics/comments/4b2wsw,Yarnbomb in SF,Cozy.,http://reddit.com/r/pics/comments/4b2wsw/c/d15z3yo,4154,1
7277,pics,,50,https://www.reddit.com/r/pics/comments/4amdb3,George Lucas having lunch in a food court in Australia.,"Do pictures like this make anyone else feel uncomfortable? I mean, after all, this man is a human just like all of us just eating lunch. There is a line to be drawn when it comes to celebrities and an invasion of their privacy. ",http://reddit.com/r/pics/comments/4amdb3/c/d11njeq,104,1
7290,pics,,32,https://www.reddit.com/r/pics/comments/4cq8a6,Walrus embarrassed by fish birthday cake,"Its not the cake per se, its the fact that despite specifically asking mom not to tell anyone its our birthday, she still had the waitstaff sing that fucking restaurant birthday song with the clapping and shit. OMG, so embarrassing, want to die. ",http://reddit.com/r/pics/comments/4cq8a6/c/d1kfrws,242,1
7305,pics,,20,https://www.reddit.com/r/pics/comments/4c23z6,My girl and her friends homemade contest winning costumes!,https://www.reddit.com/r/pics/comments/3q94eb/hocuspocus_costumes/,http://reddit.com/r/pics/comments/4c23z6/c/d1egez9,37,1
7315,pics,,26,https://www.reddit.com/r/pics/comments/4b6he1,"Found some gold in Peace River, British Columbia, Canada.",Buy a D10! Hurry!,http://reddit.com/r/pics/comments/4b6he1/c/d16lzg5,880,1
7344,pics,,30,https://www.reddit.com/r/pics/comments/4cduk3,So Steven Tyler photobombed my cousins wedding photos.,OP is a bundle of sticks.,http://reddit.com/r/pics/comments/4cduk3/c/d1hcsjh,84,1
7351,pics,,23,https://www.reddit.com/r/pics/comments/4ak259,"On this day, March 15, 7 years ago a brave little bat wanted to explore space. Rest in peace Space Bat!",He's at my house smoking weed right now. ,http://reddit.com/r/pics/comments/4ak259/c/d11ibzj,318,7
7358,pics,,20,https://www.reddit.com/r/pics/comments/4bc23u,Abandoned Muscle Car,1969 Ford Torino. ,http://reddit.com/r/pics/comments/4bc23u/c/d17twgt,332,1
7367,pics,,20,https://www.reddit.com/r/pics/comments/496cd5,The Atlantic Ocean Road in Norway,Driving through that road video.,http://reddit.com/r/pics/comments/496cd5/c/d0pen0q,587,1
7372,pics,,23,https://www.reddit.com/r/pics/comments/493kv8,"Sometimes when I start braiding her hair, I have no idea where we will end up. Today's unusual creation is one of a kind. Have a super Saturday! Thank you all for the support :)","I don't want to one up you or anything,  but today I got my 3 y/o daughter's hair in a pony tail for dance class and there were barely any loose strands. It was a pretty great Dad moment...   (in all seriousness that's amazing!)",http://reddit.com/r/pics/comments/493kv8/c/d0p30lw,1396,4
7377,pics,,22,https://www.reddit.com/r/pics/comments/4bzbi2,Creepy Cosplay,The image you are requesting does not exist or is no longer available.,http://reddit.com/r/pics/comments/4bzbi2/c/d1efcno,3600,1
7381,pics,,21,https://www.reddit.com/r/pics/comments/48wtey,Little family,Looks like a bunch of tailgaters on the highway again,http://reddit.com/r/pics/comments/48wtey/c/d0n7opt,708,1
7396,pics,,41,https://www.reddit.com/r/pics/comments/49m2hx,Badass Level: Tattoo-faced Maori Businessman,"I'm thinking more of the situation where your company is the victim of a ""hostile takeover"", then this guy rolls in as the new branch office manager.",http://reddit.com/r/pics/comments/49m2hx/c/d0t9haz,2163,1
7398,pics,,50,https://www.reddit.com/r/pics/comments/4a8nth,The Roman Pool at Hearst Castle,"The guides were a lot of fun and extremely knowledgeable, and the castle itself really is astounding.",http://reddit.com/r/pics/comments/4a8nth/c/d0ygit4,1385,1
7412,pics,,47,https://www.reddit.com/r/pics/comments/4bm1tq,Respect,Never confuse fear for respect,http://reddit.com/r/pics/comments/4bm1tq/c/d1abvpv,69,1
7422,pics,,115,https://www.reddit.com/r/pics/comments/4a84xb,Jesus And Colonel Sanders Have A Coffee Shop Meeting.,The two most important people to the Southern United States. ,http://reddit.com/r/pics/comments/4a84xb/c/d0y95y1,4616,1
7429,pics,,28,https://www.reddit.com/r/pics/comments/4cqitu,Milk Bottles That Look Like Abducted Cows,Behance,http://reddit.com/r/pics/comments/4cqitu/c/d1kx1o4,4637,1
7430,pics,,39,https://www.reddit.com/r/pics/comments/494z8m,Tough day at daycare. One more and I have to go.,..leave the juicebox,http://reddit.com/r/pics/comments/494z8m/c/d0p3dbm,1369,7
7461,pics,,23,https://www.reddit.com/r/pics/comments/4aowv8,Eazy E skateboarding at Venice Beach wearing a bulletproof vest (1989),"I'll bet everything you say at parties is a cliche phrase, meme reference or pop culture quote, just like ""I'll bet you're real fun at parties.""",http://reddit.com/r/pics/comments/4aowv8/c/d12jkda,267,1
7465,pics,,22,https://www.reddit.com/r/pics/comments/4a9rht,No tomatoes.,"Seriously.  Who puts tomatoes on something that clearly says ""no tomatoes""?",http://reddit.com/r/pics/comments/4a9rht/c/d0yj7uf,88,1
7491,pics,,29,https://www.reddit.com/r/pics/comments/4b82mt,Tree root chandelier,which one. i must go. ,http://reddit.com/r/pics/comments/4b82mt/c/d16zfhv,5389,1
7502,pics,,38,https://www.reddit.com/r/pics/comments/4bwbiq,Today my Bird First Fly,Bullshit,http://reddit.com/r/pics/comments/4bwbiq/c/d1cz9dd,13,4
7513,pics,,31,https://www.reddit.com/r/pics/comments/4c5yu8,Boy that became a girl with hormone treatment in young age.,Brains aren't fully developed but let's let them fuck with their chemistry for the feels.,http://reddit.com/r/pics/comments/4c5yu8/c/d1fcgsf,0,1
7516,pics,,311,https://www.reddit.com/r/pics/comments/4bxsm5,Windy day in Ireland.,IT FEELS LIKE I'M RUNNING AT AN INCREDIBLE RATE,http://reddit.com/r/pics/comments/4bxsm5/c/d1dda80,6944,7
7517,pics,,77,https://www.reddit.com/r/pics/comments/49zn3h,Last time I buy a MacBook from China,That's one big hand!,http://reddit.com/r/pics/comments/49zn3h/c/d0w52d3,1412,1
7521,pics,,24,https://www.reddit.com/r/pics/comments/4b9tzb,Candidate Deathmatch. US election from a european point of view. Darth Trump vs. Jedimaster Bernie,Calling trump Hitler is the ultimate trivializaton of the holocaust ,http://reddit.com/r/pics/comments/4b9tzb/c/d17n9g8,24,1
7528,pics,,54,https://www.reddit.com/r/pics/comments/4cclsr,"I work at a bank. Sadly, this is quite common.",I pick blew. ,http://reddit.com/r/pics/comments/4cclsr/c/d1h9038,431,1
7531,pics,,93,https://www.reddit.com/r/pics/comments/4bxgjy,Iceland,"A lot of people mistakenly think Iceland is full of ice, and Greenland is covered with grass and whatnot, but that actually isn't quite true. It is actually Greenland that has a lot of ice, while Iceland is covered in hellfire.",http://reddit.com/r/pics/comments/4bxgjy/c/d1d940k,2682,1
7536,pics,,32,https://www.reddit.com/r/pics/comments/4bj5ov,My kittens outside for the first time,Are you fucking kidding me? ......that carrot tail? Fuck. ,http://reddit.com/r/pics/comments/4bj5ov/c/d1a31pq,1389,1
7565,pics,,94,https://www.reddit.com/r/pics/comments/48gbjt,How I imagine the french,Carrying bread like that must be a pain,http://reddit.com/r/pics/comments/48gbjt/c/d0jd427,1459,1
7575,pics,,22,https://www.reddit.com/r/pics/comments/4by8gx,Depression,Projection.  ,http://reddit.com/r/pics/comments/4by8gx/c/d1dildx,318,1
7596,pics,,36,https://www.reddit.com/r/pics/comments/48l3t4,More bark than bite.....,The thumbnail led me to believe it was a polar bear.,http://reddit.com/r/pics/comments/48l3t4/c/d0kh9lr,3775,1
7597,pics,,27,https://www.reddit.com/r/pics/comments/4bcd0c,View of south America from space,"This is an artist rendering, not a real photo. ",http://reddit.com/r/pics/comments/4bcd0c/c/d17twbk,17,1
7621,pics,,23,https://www.reddit.com/r/pics/comments/4bircu,Baby Turtles, is the dirty jobs episode on YouTube. ,http://reddit.com/r/pics/comments/4bircu/c/d1a1z2k,2783,1
7656,pics,,31,https://www.reddit.com/r/pics/comments/4c4x45,"IKEA names colorful pillow case ""Putin""",But it costs 49 penises.,http://reddit.com/r/pics/comments/4c4x45/c/d1fb377,1848,1
7657,pics,,20,https://www.reddit.com/r/pics/comments/48vbr4,"The Rock, MTV Video Music Awards (2000)",I can almost smell what he's cooking.,http://reddit.com/r/pics/comments/48vbr4/c/d0muhv7,339,1
7686,pics,,21,https://www.reddit.com/r/pics/comments/4c9o57,Romania's Bigar Waterfall,It's Romania's big-assed waterfall. ,http://reddit.com/r/pics/comments/4c9o57/c/d1g7hnj,2766,0
7707,pics,,24,https://www.reddit.com/r/pics/comments/49960u,Cats will be cats,Cat. ,http://reddit.com/r/pics/comments/49960u/c/d0qisq6,2668,1
7715,pics,,39,https://www.reddit.com/r/pics/comments/4aswc4,The dump truck from Hell,http://i.imgur.com/g9vV8e6.gif,http://reddit.com/r/pics/comments/4aswc4/c/d13acr9,2189,1
7718,pics,,39,https://www.reddit.com/r/pics/comments/4chn3e,"My mom was exhausted after a 6 hour flight, but still had to go through customs",Six hours is a cakewalk.  ,http://reddit.com/r/pics/comments/4chn3e/c/d1i94f0,198,1
7720,pics,,29,https://www.reddit.com/r/pics/comments/4alztx,A moving tribute,Dammit!..a tattoo is not supposed to make me feel this way. Going to hug my son now. ,http://reddit.com/r/pics/comments/4alztx/c/d11le0e,594,1
7747,pics,,31,https://www.reddit.com/r/pics/comments/49tan4,"The only picture ever taken of Concorde flying at Mach 2 (1,350 mph). Taken from an RAF Tornado fighter jet, which only rendezvoused with Concorde for 4 minutes over the Irish Sea: The Tornado was rapidly running out of fuel, struggling to keep up with Concorde at Mach 2.",life would just stop for a minute.  sometimes it set off car alarms.  1pm every day!,http://reddit.com/r/pics/comments/49tan4/c/d0upuhs,887,1
7759,pics,,23,https://www.reddit.com/r/pics/comments/48e444,Chinese mobile phone bots farm,Fyi asians are all super racist about other asians.,http://reddit.com/r/pics/comments/48e444/c/d0jda72,323,1
7768,pics,,56,https://www.reddit.com/r/pics/comments/4ajicl,A school lunch in Sweden,"Grilled Salmon, Peas, 2 Potatoes, half a quart of jizz",http://reddit.com/r/pics/comments/4ajicl/c/d1127dx,340,3
7771,pics,,23,https://www.reddit.com/r/pics/comments/4cixhs,Some guy came into my local pub running for president. These are his promises,And fonts will get more legible with time ,http://reddit.com/r/pics/comments/4cixhs/c/d1imac7,75,1
7778,pics,,26,https://www.reddit.com/r/pics/comments/49ypf0,Turns out my parents had swagger...just 1975 swagger.,...when you look at old pictures and realize you'd tap your own mom.,http://reddit.com/r/pics/comments/49ypf0/c/d0w9mxr,1696,1
7779,pics,,45,https://www.reddit.com/r/pics/comments/4bfss5,"This is the Page family from California. Their daughter they adopted at 17 months old, who is 1.5% Choctaw, was ripped from her father's arms today by the L.A. DCFS as part of a court ruling in relation to the Indian Child Welfare Act. See the comments for more details.","At the age of 2, she was placed with the Page family, where she bonded and thrived, according to court documents. After efforts to reunify the family failed, the father, the tribe and the Department of Children and Family Services recommended the girl be placed in Utah with a non-Indian couple who are extended family of the father. The court agreed, finding that the Page family ""had not proven by clear and convincing evidence that it was a certainty the child would suffer emotional harm by the transfer.""",http://reddit.com/r/pics/comments/4bfss5/c/d18rnzk,58,1
7785,pics,,21,https://www.reddit.com/r/pics/comments/4a9a3o,Some Trump supporters vandalized my car over an anti-trump bumper sticker I made,"You'll have to excuse me for being so skeptical, but your account is brand new and the writing on the hood of the car looks so fucking fake its funny.",http://reddit.com/r/pics/comments/4a9a3o/c/d0yfvrl,8,1
7811,pics,,34,https://www.reddit.com/r/pics/comments/4bfgwn,Bathroom Signs,Some of these I would never know that they are sign for bathrooms.,http://reddit.com/r/pics/comments/4bfgwn/c/d18pf6a,303,1
7817,pics,,21,https://www.reddit.com/r/pics/comments/4a6jxq,"What 300,000 dollars in Hawaii buys you",Bay Area: WOW SWEET DEAL!,http://reddit.com/r/pics/comments/4a6jxq/c/d0xwti3,119,1
7839,pics,,22,https://www.reddit.com/r/pics/comments/4bg4qo,I came across this today. I feel broken inside.,Maybe the building never changed; you just got older.,http://reddit.com/r/pics/comments/4bg4qo/c/d18thmx,183,4
7843,pics,,43,https://www.reddit.com/r/pics/comments/4bxrdd,Bionic arm repair,That flathead is way too big yo,http://reddit.com/r/pics/comments/4bxrdd/c/d1dcz54,263,1
7862,pics,,181,https://www.reddit.com/r/pics/comments/490lwn,Spotted a time traveller.,Kinda sad people can't just have their own style without internet addicts taking their picture and posting it online to be ridiculed.,http://reddit.com/r/pics/comments/490lwn/c/d0obh1v,578,1
7876,pics,,20,https://www.reddit.com/r/pics/comments/4b2qt2,"This couple couldn't sit next to each other on the flight, they did they next best thing.",Tripping everyone that walks down that aisle is the next best thing? ,http://reddit.com/r/pics/comments/4b2qt2/c/d15kt81,11,5
7893,pics,,34,https://www.reddit.com/r/pics/comments/4a6z63,Photobombed.,http://i.imgur.com/MCueSfH.gif,http://reddit.com/r/pics/comments/4a6z63/c/d0y52q3,4153,1
7912,pics,,26,https://www.reddit.com/r/pics/comments/4cl42x,So I shaved a kiwi,Why would I peel a kiwi?,http://reddit.com/r/pics/comments/4cl42x/c/d1j5r7i,481,1
7913,pics,,20,https://www.reddit.com/r/pics/comments/49yzgp,Balconies in Copenhagen," of three designs of balcony. The one, posted by op, which is completely exposed to any neighbour, a semi-private balcony that only lets you see a few of your neighbours, and the more traditional type that allows you to use your balcony as an extension of your living space while treating the opening like a typical window. ",http://reddit.com/r/pics/comments/49yzgp/c/d0we8ml,1544,1
7918,pics,,36,https://www.reddit.com/r/pics/comments/49tn7a,Cow shoes used by moonshiners during Prohibition to disguise their footprints... circa 1922,"Unregulated alcohol is the one thing that divides me. On one hand I thoroughly enjoy, not going blind from getting drunk. And on the other hand DIY-booze is so bad it's good.",http://reddit.com/r/pics/comments/49tn7a/c/d0upnoc,1264,3
