,subreddit,body,comment_score,self_url,title,comment,link,score,clusters
1854,pics,,26,https://www.reddit.com/r/pics/comments/4b5tn5,"Flint Water Crisis was the 2nd Priority for Governor Rick Snyder on December 17, 2015","If #1 isn't ""build the base for the RoboCop statue"" then he really needs to resign.",http://reddit.com/r/pics/comments/4b5tn5/c/d16bbff,169,1
1872,pics,,23,https://www.reddit.com/r/pics/comments/4c55y9,"If you aren't going to tip, don't say anything at all",You wrote 3 paragraphs of text that included repeating the same 2 sentences over and over again,http://reddit.com/r/pics/comments/4c55y9/c/d1fcg25,1119,5
1878,pics,,145,https://www.reddit.com/r/pics/comments/4a92gn,Orca Caught In Mid-air,"So we got to come back for free the next year and we did see whales, but my camera was out of memory. So I replaced the memory card only to have it run out of batteries.",http://reddit.com/r/pics/comments/4a92gn/c/d0yeuao,4964,1
1885,pics,,30,https://www.reddit.com/r/pics/comments/4bm4jh,The alphabet carved in a piece of mechanical pencil lead,I guess I just wasn't fully amazed and I try not to throw big awe inspiring words around  unless I'm actually feeling that way. ,http://reddit.com/r/pics/comments/4bm4jh/c/d1amo0c,5639,1
1888,pics,,30,https://www.reddit.com/r/pics/comments/48mqaa,The newly dedicated Robin Williams Tunnel.,Needs a couple legs sticking out on either side. ,http://reddit.com/r/pics/comments/48mqaa/c/d0l84wf,2313,1
1916,pics,,130,https://www.reddit.com/r/pics/comments/4bmv0b,"I live in Denver where yesterday it was 65 and sunny and today it is blizzard conditions with an expected 10"" of snow. As I was driving to work I caught this emergency road sign that correctly summarized my feelings.","EDIT: I got the email issue resolved. They sent out a ""don't come in because it's a blizzard"" email yesterday morning, but since yesterday was my 3rd day on the job, I'm not on the emailing list yet.",http://reddit.com/r/pics/comments/4bmv0b/c/d1arq6f,4530,4
1920,pics,,57,https://www.reddit.com/r/pics/comments/4a9ht9,Banner in My Local Library,"more to the point, they have access to resource databases that you cant necessarily get to from google full of good research sources.",http://reddit.com/r/pics/comments/4a9ht9/c/d0yqlyd,1908,1
1929,pics,,32,https://www.reddit.com/r/pics/comments/4ceyna,This is my kind of show!,Thats the right way to do it you fucking degenerate,http://reddit.com/r/pics/comments/4ceyna/c/d1hjd7h,5725,1
1941,pics,,23,https://www.reddit.com/r/pics/comments/48xew1,Finished then realized I painted a browser...,"That helps.. gives it more of a Nike, Just Do It for Firefox feel, but suppresses the 9/11 vibe. ",http://reddit.com/r/pics/comments/48xew1/c/d0nov0y,3898,1
1958,pics,,36,https://www.reddit.com/r/pics/comments/4bza2c,View of Denver from the Southwest skies.,The prairie is to the east,http://reddit.com/r/pics/comments/4bza2c/c/d1e0v4a,2728,1
1963,pics,,39,https://www.reddit.com/r/pics/comments/4ab0uf,Having roommates sucks (this is why we can't have nice things),Sounds like a lovely person to have as a roomate,http://reddit.com/r/pics/comments/4ab0uf/c/d0z7k9w,2855,5
1964,pics,,27,https://www.reddit.com/r/pics/comments/49acx7,My grandmother passed away recently. This is all she left me.,"Hearing our expert said 7,500,000 dollars...its kind of an odd piece, it's going to sit in the shop a while, best I can do is 47 dollars...",http://reddit.com/r/pics/comments/49acx7/c/d0qm5lt,742,1
1969,pics,,65,https://www.reddit.com/r/pics/comments/49auzy,jacked Russel terrier,Thanks for the title when I repost it in a week.,http://reddit.com/r/pics/comments/49auzy/c/d0qqrh2,2267,1
1994,pics,,22,https://www.reddit.com/r/pics/comments/4cdtrz,A Year Of Sunsets In One Picture,This is legit the first time I've seen it,http://reddit.com/r/pics/comments/4cdtrz/c/d1hhlwr,5298,1
1999,pics,,70,https://www.reddit.com/r/pics/comments/4a3p7t,These extremely rare frogs which look like they are covered in moss have been bred in a UK wildlife park.,http://i.imgur.com/Pfv3eid.jpg,http://reddit.com/r/pics/comments/4a3p7t/c/d0xd5as,4633,1
2010,pics,,173,https://www.reddit.com/r/pics/comments/4ae5fe,Can i speak to manager,It's the small bitches that bark the most.,http://reddit.com/r/pics/comments/4ae5fe/c/d0zmlfx,4055,1
2012,pics,,58,https://www.reddit.com/r/pics/comments/4aczno,Friend of mine got a closeup photo of this fly trapped in the netting of a trampoline.,I believe it's the net around the trampoline,http://reddit.com/r/pics/comments/4aczno/c/d0zp41s,4500,1
2013,pics,,94,https://www.reddit.com/r/pics/comments/49pjrw,They are amongst us,"ak ak ak, ak!",http://reddit.com/r/pics/comments/49pjrw/c/d0tpoja,2821,1
2024,pics,,170,https://www.reddit.com/r/pics/comments/4a9ca6,Immigrants at the border of Hungary,"Should be noted that the wall was primarily effective because people just went to the next country, and passed there.",http://reddit.com/r/pics/comments/4a9ca6/c/d0ynf5g,3547,1
2035,pics,,88,https://www.reddit.com/r/pics/comments/4b683a,Where did this elevator take me?,Congratulations! You've unlocked a secret level with the architect.,http://reddit.com/r/pics/comments/4b683a/c/d16fjru,1252,1
2036,pics,,21,https://www.reddit.com/r/pics/comments/49fw9p,My girlfriend met her Doppelganger,We all know the 4 of you banged. Why don't you just go ahead and share that video. ,http://reddit.com/r/pics/comments/49fw9p/c/d0rhyus,487,1
2038,pics,,91,https://www.reddit.com/r/pics/comments/4ccfvw,How to announce you're not keeping the pregnancy,So much embarrassment could have been avoided if he'd chosen a catcher's mitt instead of the bat for his prop. ,http://reddit.com/r/pics/comments/4ccfvw/c/d1hbruz,1733,1
2044,pics,,34,https://www.reddit.com/r/pics/comments/48vbzj,What an awful parent,here it is,http://reddit.com/r/pics/comments/48vbzj/c/d0n15ny,4607,1
2047,pics,,208,https://www.reddit.com/r/pics/comments/48dtj9,Eminem's hand written lyrics for Lose Yourself,How long was your coma?,http://reddit.com/r/pics/comments/48dtj9/c/d0j6ip7,6010,0
2051,pics,,42,https://www.reddit.com/r/pics/comments/48m286,"Years ago Red Bull were taken to court regarding their false statement of ""Red Bull gives you wings"". Anyone who purchased red bull could apply for monies back if you purchased the drink. Today I received my cheque for $4.25.",Yes. Yes he is.,http://reddit.com/r/pics/comments/48m286/c/d0kokib,1735,4
2060,pics,,296,https://www.reddit.com/r/pics/comments/4b87zl,Goat enjoys the view,The predators are MUCH higher risk than falling so they deliberately go into these places to avoid them.,http://reddit.com/r/pics/comments/4b87zl/c/d172kla,6021,1
2071,pics,,2177,https://www.reddit.com/r/pics/comments/48zwjz,WARNING: Trail Closed - Dangerous Conditions,Stupid alligator. Did he not read the sign?,http://reddit.com/r/pics/comments/48zwjz/c/d0o749u,6091,1
2075,pics,,25,https://www.reddit.com/r/pics/comments/4aggl2,Visited a monkeynaut's grave. Bananas for scale.,Oh God that's dark.,http://reddit.com/r/pics/comments/4aggl2/c/d10g0vv,4739,0
2082,pics,,187,https://www.reddit.com/r/pics/comments/4b6lk2,This hotel is very passive aggressive.,"Things in a hotel room that are acceptable to steal: toiletries, the pen and paper pad they leave on your table, coffee... that's about it. I've accidentally stolen and hand towel or two before when they get mixed up in my dirty laundry, but people who intentionally clean out rooms are assholes.",http://reddit.com/r/pics/comments/4b6lk2/c/d16oyq7,2330,1
2116,pics,,20,https://www.reddit.com/r/pics/comments/4bluy3,Much bigger than Niagara...much less tourists than Niagara,"Live in Buffalo, USA (10 minute drive to NF). The Canadian side is so much better in terms of viewing. As far as excursions go, the U.S. side has a lot more going for it. Though, I don't advice walking anywhere outside the vicinity of NF on the American side...it's definitely not the safest place in the U.S.",http://reddit.com/r/pics/comments/4bluy3/c/d1ag2nr,5266,1
2121,pics,,36,https://www.reddit.com/r/pics/comments/4a3l7r,A seal amongst the weed,With a joke like that I'm not surprised you have no friends,http://reddit.com/r/pics/comments/4a3l7r/c/d0xci6o,7069,1
2123,pics,,37,https://www.reddit.com/r/pics/comments/4axwwn,amazingly crafted wavy dresser.,"You can just say you made one for your cousin once, you don't have to write source ",http://reddit.com/r/pics/comments/4axwwn/c/d14lqt9,7164,1
2128,pics,,36,https://www.reddit.com/r/pics/comments/4a50lb,Owl mid-flight,Or maybe a giant slingshot.,http://reddit.com/r/pics/comments/4a50lb/c/d0xm6ow,5986,1
2171,pics,,55,https://www.reddit.com/r/pics/comments/4cf2ef,"For you city folks, this is how bacon cheeseburgers are made.",The fuck ( ͡° ͜ʖ ͡°),http://reddit.com/r/pics/comments/4cf2ef/c/d1hkxo0,2890,1
2184,pics,,23,https://www.reddit.com/r/pics/comments/4cn4fi,My GF found a baby squirrel that fell out of a tree today. Google said keep the baby squirrel warm.,Take the bedding with him? Seriously? This sounds like a kid leaving for college or something. That's pretty damn cute.,http://reddit.com/r/pics/comments/4cn4fi/c/d1jzn80,699,4
2191,pics,,30,https://www.reddit.com/r/pics/comments/4aaiih,John Boyega visits a hospital as Finn,Why are they doing PR shoots before the movie is even out? The kids haven't seen your movie and probably haven't seen the original either. ,http://reddit.com/r/pics/comments/4aaiih/c/d0z7xa9,3793,1
2193,pics,,38,https://www.reddit.com/r/pics/comments/4amr6e,Saw mega yacht on fire today.,This time they knew there's always money in the banana stand.,http://reddit.com/r/pics/comments/4amr6e/c/d11u8zw,6812,4
2200,pics,,64,https://www.reddit.com/r/pics/comments/49t6vf,Subway Entrance,Vault entrance!,http://reddit.com/r/pics/comments/49t6vf/c/d0uoak8,6149,1
2212,pics,,21,https://www.reddit.com/r/pics/comments/4b02d3,"In Salt Lake City today, 2 hours before he even arrives, there is a line half a mile long to see Bernie Sanders.","Wait, are you comparing Bernie supporters giving up on him because he has no chance of winning too stoping a genocidal manic that wanted world domination? Wtf.",http://reddit.com/r/pics/comments/4b02d3/c/d1571pi,2391,4
2213,pics,,21,https://www.reddit.com/r/pics/comments/4a1yyl,"Thousands protest in Chicago over Donald Trump, causing him to cancel his speech.","If the situation was flipped to a Sanders rally, reddit would flip shit, but because it's a Trump rally, it's okay to act like a pack of Neanderthals who are incapable of civilized discussion. ",http://reddit.com/r/pics/comments/4a1yyl/c/d0wrfg1,63,1
2215,pics,,78,https://www.reddit.com/r/pics/comments/4aqodv,Texas flood victim moved to his roof,Hey guys I found the optimist!!!!!,http://reddit.com/r/pics/comments/4aqodv/c/d12vhc5,8375,1
2241,pics,,27,https://www.reddit.com/r/pics/comments/4b62qc,How we watch TV,TAKE THE TREE DOWN!!!,http://reddit.com/r/pics/comments/4b62qc/c/d16csor,2029,1
2245,pics,,48,https://www.reddit.com/r/pics/comments/4cdouq,Friend of mine painted a jazz cup egg,Also we didn't get her killed!,http://reddit.com/r/pics/comments/4cdouq/c/d1hko79,4877,5
2252,pics,,36,https://www.reddit.com/r/pics/comments/4ac1yz,"Never forget, never forgive",The Empire did nothing wrong. ,http://reddit.com/r/pics/comments/4ac1yz/c/d0zc8rs,3857,1
2254,pics,,54,https://www.reddit.com/r/pics/comments/4ayu4m,Glowing Base Of Tree Made By Arranging Leaves,well... it is made of wood,http://reddit.com/r/pics/comments/4ayu4m/c/d14rw7e,14422,1
2257,pics,,317,https://www.reddit.com/r/pics/comments/48srxd,Got to serve John Goodman today!,Have you ever heard of Vietnam?,http://reddit.com/r/pics/comments/48srxd/c/d0m7a3y,4009,4
2258,pics,,24,https://www.reddit.com/r/pics/comments/49o17z,Miniature Bob Ross.,saves a boatload on frames,http://reddit.com/r/pics/comments/49o17z/c/d0tl9ip,5517,1
2259,pics,,88,https://www.reddit.com/r/pics/comments/4ask74,"The 3245 year old seal on Tutankhamen's tomb before it was broken, 1922","its not that much newer tho. It was replaced a few years after Tuts death, not a few years before its discovery.",http://reddit.com/r/pics/comments/4ask74/c/d13g8lr,5637,1
2273,pics,,86,https://www.reddit.com/r/pics/comments/48iryy,A guy at my University in Canada walking to class,"It was warm last week, got cold this week, supposed to be warm again next week. Guy probably got so excited for summer he got into summer mode. Except it got cold again but he said fuck it. That's like super common in Canada. We get some hope that winter might be over and when it isn't some just say fuck it, I don't care, I said it's summer, I'm staying in summer.",http://reddit.com/r/pics/comments/48iryy/c/d0k9k2o,4024,4
2277,pics,,87,https://www.reddit.com/r/pics/comments/4big1h,The awkward moments that come after 50 years without diplomacy,"Yeah, that guy is literally Hitler",http://reddit.com/r/pics/comments/4big1h/c/d1a9nsi,3820,1
2288,pics,,112,https://www.reddit.com/r/pics/comments/4bmwzb,The Hidden Town,http://i.imgur.com/RpcfXv5.jpg,http://reddit.com/r/pics/comments/4bmwzb/c/d1avbam,5330,1
2294,pics,,61,https://www.reddit.com/r/pics/comments/4cgt0j,Man asks highjacker for a selfie during today's EgyptAir plane highjack,Who sought the finest anal beads,http://reddit.com/r/pics/comments/4cgt0j/c/d1ijf4b,3104,4
2296,pics,,79,https://www.reddit.com/r/pics/comments/4apqeb,"Last night, someone projected this onto Trump Tower in Chicago.",Wiki/BernCenters.Org,http://reddit.com/r/pics/comments/4apqeb/c/d12v5t1,5453,1
2300,pics,,57,https://www.reddit.com/r/pics/comments/4bjwqi,Marathon spectators,These should work quite nicely.,http://reddit.com/r/pics/comments/4bjwqi/c/d1a1i24,5042,1
2311,pics,,31,https://www.reddit.com/r/pics/comments/49d0r7,THIS is how you cosplay as lara croft,"No worries, everyone does that once in a wh- Hey! Wait a minute!",http://reddit.com/r/pics/comments/49d0r7/c/d0qzjtw,3482,1
2315,pics,,29,https://www.reddit.com/r/pics/comments/4cko9p,Talons of a Crowned Eagle,Forgive me sensei. I did not smell what was cookin'.,http://reddit.com/r/pics/comments/4cko9p/c/d1j7t50,5537,1
2326,pics,,26,https://www.reddit.com/r/pics/comments/4ch1pt,It's been a good winter in Steamboat Springs, ,http://reddit.com/r/pics/comments/4ch1pt/c/d1ih73v,5808,0
2339,pics,,51,https://www.reddit.com/r/pics/comments/4bwjwv,"The best landscape picture I ever took from my phone. This is in the heart Lancaster County, Pennsylvania.",FTFY,http://reddit.com/r/pics/comments/4bwjwv/c/d1d1a2f,2793,1
2347,pics,,26,https://www.reddit.com/r/pics/comments/48lhn1,Meanwhile in Tasmania..,Off of the dead girl? C'mon son ,http://reddit.com/r/pics/comments/48lhn1/c/d0kr1h3,6247,9
2359,pics,,69,https://www.reddit.com/r/pics/comments/49kz8z,"My fiancée and I live in Anchorage, and she said she wanted a wedding ceremony that ""really felt Alaskan."" I think I nailed it.","Congrats on the wedding, by the way! ",http://reddit.com/r/pics/comments/49kz8z/c/d0smuy1,4959,1
2366,pics,,70,https://www.reddit.com/r/pics/comments/4a1m3n,My classmate stayed home and streamed instead of attending class today. Someone busted him,So now the entire class is skipping school? ,http://reddit.com/r/pics/comments/4a1m3n/c/d0wxu7l,1654,4
2368,pics,,32,https://www.reddit.com/r/pics/comments/4a89ec,Cut from an old oil tank,that goes for acetone as well ,http://reddit.com/r/pics/comments/4a89ec/c/d0y9w5z,4659,1
2383,pics,,377,https://www.reddit.com/r/pics/comments/4avgrq,When the bully in your school is your best friend,I still saw ducks until I read this comment,http://reddit.com/r/pics/comments/4avgrq/c/d13w2as,8979,3
2387,pics,,24,https://www.reddit.com/r/pics/comments/48ayk5,"""He's fatter, I'm thinner"" Kate Winslet on 19 years of friendship with Leo.",Pic I took for reference,http://reddit.com/r/pics/comments/48ayk5/c/d0is35y,5029,0
2389,pics,,64,https://www.reddit.com/r/pics/comments/4aal9k,But why is this sign in the bathroom?,A poignant message.,http://reddit.com/r/pics/comments/4aal9k/c/d0ywdk9,4362,1
2393,pics,,47,https://www.reddit.com/r/pics/comments/4bj49f,Pics from a Chinese gangsters phone,Check out ma murder victim.,http://reddit.com/r/pics/comments/4bj49f/c/d19u8mb,2212,1
2399,pics,,56,https://www.reddit.com/r/pics/comments/4ayeug,Password?,"Basically, you're watching a computer ""think."" DeepMind is trying to make associations with faces, current phase has it doing that with animals--so you see more attempts to associate pattens with animal faces.",http://reddit.com/r/pics/comments/4ayeug/c/d14qe9o,10415,1
2401,pics,,53,https://www.reddit.com/r/pics/comments/4a6n8z,There is something wrong here...,"Dang, spoiler tags for a 27 year old movie based on an even older fairy tale. ",http://reddit.com/r/pics/comments/4a6n8z/c/d0ya2cm,4549,6
2404,pics,,418,https://www.reddit.com/r/pics/comments/4c5q99,Group of WW2 vets at church on Easter Sunday.,"It's odd to think, but we might be coming up on a time soon where there will be no more living WW2 vets in the world.",http://reddit.com/r/pics/comments/4c5q99/c/d1f9dru,4128,1
2425,pics,,104,https://www.reddit.com/r/pics/comments/4ce4va,"300 year old library in Dublin, Ireland.",Just came back from Dublin! The Long Hall / Book of Kells was amazing!!﻿,http://reddit.com/r/pics/comments/4ce4va/c/d1hdxgy,4804,1
2430,pics,,25,https://www.reddit.com/r/pics/comments/4a3cu5,Beauty and beast,Don't call that child a beast! ,http://reddit.com/r/pics/comments/4a3cu5/c/d0x6p60,5006,1
2431,pics,,28,https://www.reddit.com/r/pics/comments/4921ew,Elementary school students line up for a yearbook signature from the school janitor," Mr. Kennedy!""",http://reddit.com/r/pics/comments/4921ew/c/d0okpj4,4990,3
2437,pics,,315,https://www.reddit.com/r/pics/comments/4c240f,The steering wheel for the 1972 Maserati Boomerang.,looks like a super delorean  ,http://reddit.com/r/pics/comments/4c240f/c/d1em412,5236,1
2438,pics,,59,https://www.reddit.com/r/pics/comments/4a83gq,Table made of resin and travertine marble.,"You got your Beemers cheap in USA, so I guess upper middle class should be able to afford new easily.",http://reddit.com/r/pics/comments/4a83gq/c/d0yb6vo,6842,1
2473,pics,,58,https://www.reddit.com/r/pics/comments/4asy16,My uncle has been taking some pretty sweet pictures with his drone,Just get a bigger boat.,http://reddit.com/r/pics/comments/4asy16/c/d13ks2i,8091,1
2477,pics,,23,https://www.reddit.com/r/pics/comments/494jlh,"I work at Dominos. Late last night we saw someone going through our dumpster. We were a little worried when he started writing something on it. Turns out, we were the jerks.",What kind of pizza joint throws out perfectly good pizza? I worked at a couple different pizza places and we would ALWAYS eat the no shows or messed up orders. ,http://reddit.com/r/pics/comments/494jlh/c/d0p1d81,377,6
2483,pics,,255,https://www.reddit.com/r/pics/comments/4c3icw,Locked myself in my room for 10 hours and drew a very long line. Banana for scale.,"Where did it come from, Single-Line Joe?",http://reddit.com/r/pics/comments/4c3icw/c/d1eqr9y,3845,3
2490,pics,,21,https://www.reddit.com/r/pics/comments/49k49p,Bill Gates recreated his high school yearbook photo for his AMA identity verification,"40 years and few Billion Dollars later, dude is smiling. ",http://reddit.com/r/pics/comments/49k49p/c/d0sjkuk,5414,3
2494,pics,,39,https://www.reddit.com/r/pics/comments/49lx7s,"7"" of rain plus an empty pool",Source: I live in Texas.,http://reddit.com/r/pics/comments/49lx7s/c/d0t6ugr,3692,1
2496,pics,,240,https://www.reddit.com/r/pics/comments/4c62nj,My mother found some of my old school projects,you asked,http://reddit.com/r/pics/comments/4c62nj/c/d1fd8cw,2296,3
2511,pics,,24,https://www.reddit.com/r/pics/comments/495q1j,This is what the Minnesota State High School hockey championship game looks like,"Attendance: 19,655",http://reddit.com/r/pics/comments/495q1j/c/d0p8t4t,2261,3
2514,pics,,43,https://www.reddit.com/r/pics/comments/48hsd1,Drumpf is Donald Trump's original family name,but... trump is proud of his heritage... that's why this whole thing is buttfuck retarded. It's not his fault his last name was changed a hundred years ago. Why would he name his company after his great grandfather?,http://reddit.com/r/pics/comments/48hsd1/c/d0kcl0u,3303,0
2527,pics,,31,https://www.reddit.com/r/pics/comments/49cyyg,Goodyear just unveiled this spherical tire design at the Geneva Motor Show,"It's actually I, Robot. It was originally a collection of short stories by Issac Asimov.",http://reddit.com/r/pics/comments/49cyyg/c/d0r4mda,5937,1
2543,pics,,40,https://www.reddit.com/r/pics/comments/49nvpg,Fire inside a factory,"""Hold up.  Let me get a pic real quick.  Don't wanna miss out on any karma.""",http://reddit.com/r/pics/comments/49nvpg/c/d0tbbk5,1029,0
2544,pics,,28,https://www.reddit.com/r/pics/comments/49x1xf,I've never been more stressed out,Causing the guy to turn to face you knocking the drink over as he moves his arm. ,http://reddit.com/r/pics/comments/49x1xf/c/d0vvj2v,6449,1
2549,pics,,28,https://www.reddit.com/r/pics/comments/4bba1j,My Australian friend made this horrifying discovery at the back of his house today,Put another shrimp on the prawn!,http://reddit.com/r/pics/comments/4bba1j/c/d181pkm,833,4
2551,pics,,239,https://www.reddit.com/r/pics/comments/4brmg0,The ritual is complete.,What a pleasant exchange.,http://reddit.com/r/pics/comments/4brmg0/c/d1bz32e,5624,1
2553,pics,,50,https://www.reddit.com/r/pics/comments/4bh3rz,Tina Fey in her College Days,"This is a reference to the television comedy series 30 Rock. Alec Baldwin's character uses it as a catch phrase in response to every time Tina Fey's character, Liz Lemon, does something awkward, quirky or generally Fey-like in nature.",http://reddit.com/r/pics/comments/4bh3rz/c/d19khx7,1960,7
2577,pics,,86,https://www.reddit.com/r/pics/comments/48gb6w,56 Days of Sobriety!,?,http://reddit.com/r/pics/comments/48gb6w/c/d0jcc5l,2499,7
2582,pics,,24,https://www.reddit.com/r/pics/comments/49czls,This vending machine hasn't been updated in 17 years.,Pleased to meet you...NOW THIS IS PODRACING!!,http://reddit.com/r/pics/comments/49czls/c/d0qvbat,6185,5
2585,pics,,177,https://www.reddit.com/r/pics/comments/4bdkh7,You probably should have left out that last part,"Oh god, the typography here is painful to look at. Horrible font combinations, claustrophobic tracking, missing counters?!",http://reddit.com/r/pics/comments/4bdkh7/c/d187418,1249,1
2588,pics,,222,https://www.reddit.com/r/pics/comments/4cljx0,Nostalgia,"""It's a living.""",http://reddit.com/r/pics/comments/4cljx0/c/d1jadzt,4562,1
2603,pics,,20,https://www.reddit.com/r/pics/comments/497jj4,Samuel Whittemore. Revolutionary Badass!, ,http://reddit.com/r/pics/comments/497jj4/c/d0pon0s,5609,1
2609,pics,,100,https://www.reddit.com/r/pics/comments/49yxk1,"Bela Borsodi single Photograph, looks like four separate images",And the blue chair in the top left,http://reddit.com/r/pics/comments/49yxk1/c/d0w96bf,5280,1
2633,pics,,44,https://www.reddit.com/r/pics/comments/49yqbn,glorious Switzerland,http://i.imgur.com/5oPMLkq.png,http://reddit.com/r/pics/comments/49yqbn/c/d0wbtxh,5733,1
2634,pics,,39,https://www.reddit.com/r/pics/comments/4cly0c,"Extremely rare Maltese Tiger, also known as 'Blue Tiger'","Here's the original, unshopped pic.",http://reddit.com/r/pics/comments/4cly0c/c/d1jkvbb,1123,1
2642,pics,,132,https://www.reddit.com/r/pics/comments/48caft,Wine and chocolate pineapple,"Realistically, if I had pineapples and heard the second challenge, I would just give up. Ten pineapples is bigger than my torso, so it just isn't gonna happen even if they give me a pass on the facial expression and I'm willing to completely destroy my asshole.",http://reddit.com/r/pics/comments/48caft/c/d0iq6o3,5441,1
2645,pics,,27,https://www.reddit.com/r/pics/comments/49ied6,Rattlesnake found near a friends house in New Mexico,Forced perspective at its finest. ,http://reddit.com/r/pics/comments/49ied6/c/d0rzved,89,1
2648,pics,,22,https://www.reddit.com/r/pics/comments/48ltqq,"Swimming Hole, literally","Very slippery. Ate shit trying to jump off the ledge. Big bruise on my ass. Also related to my ass and Cancun, had diarrhea the entire trip. ",http://reddit.com/r/pics/comments/48ltqq/c/d0krdp8,5287,1
2656,pics,,42,https://www.reddit.com/r/pics/comments/4bjwgg,Saw this at my GYNO in NYC,I don't understand how America doesn't have Universal Healthcare. I live in the UK and the thought of not having the National Health Service scares me.,http://reddit.com/r/pics/comments/4bjwgg/c/d19tcij,1873,1
2664,pics,,77,https://www.reddit.com/r/pics/comments/48ud7v,"Walmart worker carries sign showing reading ""Shorter Line"". Couldn't they just use her behind a register?",Then there were the circus days where I'd just stay on and as the cashiers needed a 21 or whatever we'd just switch and play musical checklanes all day. Retail is fun when your store is cutting payroll. ,http://reddit.com/r/pics/comments/48ud7v/c/d0my3in,4945,5
2667,pics,,52,https://www.reddit.com/r/pics/comments/4bk3oi,The Iron Man Pizza did not disappoint.,Kevin Mcallister ,http://reddit.com/r/pics/comments/4bk3oi/c/d1a7cd4,4010,1
2674,pics,,89,https://www.reddit.com/r/pics/comments/4b6uiy,My son has an overactive imagination. He refuses to sleep alone unless his sentinels guard his chamber entrance.,"It's wearing sunglasses too, so you know that giraffe is a hard motherfucker. ",http://reddit.com/r/pics/comments/4b6uiy/c/d16rybl,4298,1
2683,pics,,822,https://www.reddit.com/r/pics/comments/4bs719,Coins hammered into a log for good luck,I don't know why but this makes me... uncomfortable.,http://reddit.com/r/pics/comments/4bs719/c/d1c2w28,5543,1
2684,pics,,52,https://www.reddit.com/r/pics/comments/4b6xzo,"Sad, but true","Actually, it should read ""In the beginning the Universe was created.
This has made a lot of people very angry and been widely regarded as a bad move.""",http://reddit.com/r/pics/comments/4b6xzo/c/d173ytk,1403,1
