,subreddit,body,comment_score,self_url,title,comment,link,score,clusters
180,circlejerk,Blaze itEDIT:RIP INBOX xDDDDDD,36,https://www.reddit.com/r/circlejerk/comments/49yz3b,Meme King Dead at Age 420,D,http://reddit.com/r/circlejerk/comments/49yz3b/c/d0w3jyf,3280,4
247,circlejerk,,40,https://www.reddit.com/r/circlejerk/comments/490cea,i literally just want karma,http://i.imgur.com/RSk7PaX.gifv,http://reddit.com/r/circlejerk/comments/490cea/c/d0oioyb,2544,5
475,circlejerk,,206,https://www.reddit.com/r/circlejerk/comments/49qmjh,I literally just want karma.,Lol almost didnt notice 😂😆😅😄😃,http://reddit.com/r/circlejerk/comments/49qmjh/c/d0u9rm1,3576,5
872,circlejerk,edit: thanks for the gold kind stranger!,21,https://www.reddit.com/r/circlejerk/comments/4cjghd,"Hillary Clinton: ""24fps is more cinematic than 60fps""","Guitar riff in the distance, ominous but still relaying a message through the notes that are being played for the Bernie the Sanders Guy tv show sponsored by Disney.",http://reddit.com/r/circlejerk/comments/4cjghd/c/d1ix7j1,3326,9
1192,circlejerk,http://i.imgur.com/V1Uu7Lz.jpg,169,https://www.reddit.com/r/circlejerk/comments/49idyh,This is Donald. He knocked on my door to ask if he could have a small loan of a milion dollars then left.,OP is literally Ellen Pao,http://reddit.com/r/circlejerk/comments/49idyh/c/d0s4ibl,3155,3
1557,circlejerk,,60,https://www.reddit.com/r/circlejerk/comments/48hmle,"Donald Trump releases new book about the struggles of growing up with only a small loan of a million dollars. 'Mein Kampf"" will be on sale in all retail stores, and on Kindle on Weds.","TIL Bernard ""Bernie Sanders"" Sanders had an affair with Barack ""Adolf Hitler"" Obama. ",http://reddit.com/r/circlejerk/comments/48hmle/c/d0jojef,3314,9
1709,circlejerk,,26,https://www.reddit.com/r/circlejerk/comments/49z3el,Jesus has died at age 2016,"RIP Bernie ""Jesus"" Sanders :/",http://reddit.com/r/circlejerk/comments/49z3el/c/d0w1hba,314,4
1816,circlejerk,,26,https://www.reddit.com/r/circlejerk/comments/4acr5x,"If we chucked ethics out the window, what kind of dank presidential memes could we expect to see in the next 5-10 years?",/Bernie/evenwithcontext,http://reddit.com/r/circlejerk/comments/4acr5x/c/d0zq868,1722,5
1896,circlejerk,,24,https://www.reddit.com/r/circlejerk/comments/48cvos,[BREAKING] Bernie Sanders has been caught buying 1% milk.,"Hello young fellow. How are you doing at the moment? It appears to me that you are currently displeased with the situation. What is it, that is making your life so difficult at this moment? Is it perhaps caused by the recent roasting of your jeromes that so suddenly occured? I must say that this roasting is undeniably the strongest since the 2000 hoax. Do you have the slightest clue of why this particular roasting of your walters was so powerful? No? Well... I can for sure tell you the currently disclosed reason for this significant event. It was, in fact, ME who caused your displeasement. I can hear you trying to comprehend how is this possible. But, and I'm sure about this, you cannot process what has happened to you because it is far too complex for your understanding. Even God himself cannot fully understand this despicable and devilish work of trickery. It took me a lifetime to fully write out my evil plan and another to understand it. The complexity is even higher than that of a 14-faced dodecahedron. It all starts out with the day of this legendary ruse. The day of rusement so carefully planned and calculated on this exact day. The day where an astronomical constellation appeared that will never occur for another 35 eons. A constellation that has generated a powerful antimatter pool. This antimatter black hole does not only suck in matter, however. This antimatter black hole sucks in the well being of everyone living on this planet. But did you see anyone feel bad today? No? You see, my young fellow, that is because I have perfectly engineered an antimatter pool thats power is focused on you. It took me 15 years to construct this extremely complex lens and I had to combine the power of God with this lens to give it the ultimate focus. But enough with the past. As I'm not some novice ruseman, I have planned
even more, a device of trickery sprinkled with lies and logical fallacies, meant to corrupt you and send you into a pit of despair. With my ruseman insticts, I sensed that you were typing your reply to the displeasing content you have viewed. At the exact moment you pressed the left button on your mouse, clicking send, you unleashed the machine of displeasure and ""not well being"". A machine that, once started, cannot ever be stopped. Not by anyone. Not even God himself. While your comment rushed through cyberspace you started to feel bad. Something in your brain was screaming but you just didn't listen. It was destiny that you fall for my trickery. You should have thought before you foolishly sent that comment to me. But what heightens the intensity of your mistake is that you unwittingly decided to argue with a MASTER RUSEMAN GRADE 5. I was the leader of an ancient circle of rusemen. By the look on your face, it seems that you are coming to realize who it is you are dealing with. Yes, you have been RUSEDI by me. There were only one RUSEDI experienced by mankind until now. Can you imagine how hard it is to do? There are only two completed RUSEDIS in the last 3 billion years. Now you finally know the unbearable discomfort that you experienced after you got my response. This response, this message, reveals what has happened to you. You, yes you have been rused. You are powerless, you want to scream but you cannot do anything but just sit in a mix of rage and hopelessness. You want to find this man, this ruser, and you want to kill him. But, at the exact moment of thinking, you also realize that you will never ever come close to such a powerful ruseman such as myself. This puts me at a position higher than Hades. You think you can overcome this heavy rustling. You think you can bear such extraordinary rusing, but my devilish plan goes far deeper. Now that you have been rused to infinity, your discomfort rises to a near eternal level of discomfort. In the letter you are currently reading you will realize how hard you have been bamboozled. I will tell you the enchanting tale of my coming, and show you who you are really confronting. I do not know where I am from, but I know that I am the first of my kind. I rused alone but soon people followed. We created a circle called the MASTER RUSEMEN. Only the elite RUSERS could be given admission into such a legion. But after some time I led my own followers, my own CREATIONS, into a tricky situation, much less powerful than the rusing you have just experienced. I named myself MASTER RUSEMAN and made everyone else's jacobs rommle into despair. After they found out what exquisite trickery had taken place, they named me the GOD OF RUSING, a title only a RUSER RUSER could acheive. You never thought that you could have been rused by such a ruseful entity. Somehow you feel honored. Honored to have had you gustavsons jingled by the TRUE MASTER RUSEMAN. The rusement was too strong. Not even time itself could heal the wounds this monumental trickery has caused the Universe. I am, on my part, pretty rustled myself. Even I had my doubts on if I could cause a contrivance this tricky. But I proved I had the power to concieve the most thourough and well-executed RUSEDI. You have been rused by me, THE ONE AND ONLY GOD OF RUSEMEN. Even after 100 years you will remember this day. The day of THE ruse. The day I, THE GOD OF RUSEMEN personally made a statement, to intentionally discomfort YOU. This rusing, yes, this rusing has opened a new chapter in the art of rusing. Your suffering has helped advance my legacy as a ruser. You are now shocked as I seemingly award you for furthering my career. Yet, you have been tricked again. Are you befuddled? Bewildered? Or perhaps you are bamboozled by this perplexing chain of tricks. Either way, this all goes according to my devilish work. My RUSERI has left my mark on your daily life. Everyday you will be reminded of my legendary ruse, and as you try to forget, will be shot with the memory of this event. Aside the banter, you, my young friend, are quite a gullible lad. You have befallen to my elaborate schemes of claiming untruthful statements as truthful. Now, let me ask you, are you disappointed? Are your delanos properly roosevelted? Is your gluteal cleft aching? I am most sure of this fact. If everything has gone according to my devious plan, which it obviously has done so, then my statements should be free of error. I bid you good day, my buddy. Again, you have once again been tricked. I can sense that my antics and varied actions are causing your brain to focus more on your limbal system rather than the entirety of your cerebral cortex, placing much stress with your emotions, causing the desired effect of creating a vexation. Is this rusing getting to you? It appears that your hatred towards my stratagems is growing. But, you have yet to realize that it is not I that has gotten you into this unruly situation, why yes, it was you who has caused yourself a misfortune. Your ignorance has lead you to this series of unfortunate conditions. But, as I am a busy ruseman, and I must continue misleading such fools as yourself, I bid goodbye to you, young fellow. But be warned, for I will return. And when I return, everybody will be reminded of this legendary ruse. SONGS WILL BE WRITTEN ABOUT AND SUNG ON THIS DAY, THIS DAY OF THIS MASTERFUL RUSE, AND I HOLD NO REMORSE OR REGRET FOR I AM AND WILL ALWAYS BE THE GOD OF THE RUSE.",http://reddit.com/r/circlejerk/comments/48cvos/c/d0j3yor,2072,6
2147,circlejerk,,66,https://www.reddit.com/r/circlejerk/comments/4blxly,"TIL When Jimmy Kimmel asked a group of children how to solve America's debt problem after telling them ""America owes China a lot of money, $1.3 trillion"" one kid responded with ""kill everyone in china."" That kids name? Donald J Trump.",Trump = Trumpet fart 🎺🎺,http://reddit.com/r/circlejerk/comments/4blxly/c/d1aeavr,3584,9
2221,circlejerk,"Edit: wow this blew up!edit 2: rip my inbox!!edit 3: George ""Penis"" Washington was born in 1732 (thats almost 69 years ago!) and went on to become the inventor of the first meme. He received the Oscar for best actor instead of Leonardo ""Leonardo DiCaprio"" DiCaprio. This was his first meme.",317,https://www.reddit.com/r/circlejerk/comments/49b4l4,George Washington dies at age 284,"
Edit2: thx for the gold stranger xD  ",http://reddit.com/r/circlejerk/comments/49b4l4/c/d0qhru0,3161,4
2223,circlejerk,,93,https://www.reddit.com/r/circlejerk/comments/4ai7sn,"[Serious] Trump supporters, how did you manage to escape from Germany in 1945?",give me karma,http://reddit.com/r/circlejerk/comments/4ai7sn/c/d10r9bm,2210,9
2299,circlejerk,,617,https://www.reddit.com/r/circlejerk/comments/4bq7ub,H3H3Productions uploaded a video. Give me Karma.,Read this in Bernie Sanders' voice,http://reddit.com/r/circlejerk/comments/4bq7ub/c/d1bfoi7,3701,5
2382,circlejerk,http://imgur.com/r7g1E7Z,34,https://www.reddit.com/r/circlejerk/comments/49tw42,DO NOT OPEN. THIS IS HARAM. I BEG OF YOU DO NOT OPEN OR YOU WILL NEVER MAKE IT TO PARADISE. PLEASE IN THE NAME OF ALLAH DO NOT OPEN. THIS IS HARAM. THIS IS FORBIDDEN. DO NOT OPEN!!!,we need to go deeper,http://reddit.com/r/circlejerk/comments/49tw42/c/d0vcran,3080,3
2396,circlejerk,Has any one else heard of this underground candidate called Bernude Sanderstorm?,72,https://www.reddit.com/r/circlejerk/comments/4c9ny0,"TIL Hillary Clinton taught herself German at 18, just so she could read one book, the Mein Kampf--which she used as a basis for her Domestic Policy.",edit: thanks for gold kind stranger :),http://reddit.com/r/circlejerk/comments/4c9ny0/c/d1ga4c8,4908,5
2671,circlejerk,"http://pitchfork.com/news/64025-george-martin-beatles-producer-has-died/Edit: OMG FRONT PAGE! I would like to thank m00t, Donald Trump, unidan, Anita Sarkeesian, all the mods of /r/wsgy, Adrian Chen, Ellen Pao, Bernie Sanders, Ron Paul, Caitlyn Jenner, The Fine Bros, I Hate Everything, and Gallowboob for this opportunity.Edit 2: Thanks for the gold!",129,https://www.reddit.com/r/circlejerk/comments/49mr5x,George R. R. Martin has died.,▬▬▬▬▬▬▬▬▬▬ஜ۩۞۩ஜ▬▬▬▬▬▬▬▬▬▬,http://reddit.com/r/circlejerk/comments/49mr5x/c/d0t8d4a,3750,2
2682,circlejerk,EDIT: wow this is blew up,72,https://www.reddit.com/r/circlejerk/comments/49plqb,I'm osama bin laden. Ask me anything.,Who are you voting for and why is it hilary?,http://reddit.com/r/circlejerk/comments/49plqb/c/d0tppif,334,8
2756,circlejerk,,277,https://www.reddit.com/r/circlejerk/comments/4bwqfi,Upvotes. If you upvote this post it will literally appear at the top of reddit.,"
🚫ERROR!🚫 💯True💯 ✔Bernies💃👴 are irreplaceable 💖I could never delete you Bernie!💖 Send this to ten other 👴💃Bernies👴💃 who give you 💖👍socialism💖👍 Or never get called 🌷🌼️progressive🌷🌼️ again 🚫😢👎😢👎 If you get 0 Back: no free healthcare for you 🚫🏥🚫🏥 3 back: you're progressive🗽🗽 5 back: you #FEELTHEBERN 🔯🗽🔯 10+ back: You’re the first lady!💕🗽💕❤💋💑❤💋💑",http://reddit.com/r/circlejerk/comments/4bwqfi/c/d1d3tsg,4473,3
3190,circlejerk,,25,https://www.reddit.com/r/circlejerk/comments/4a8ako,"TIL 1 in 10 people are allergic to pistachio nuts, but they may not even realize it because the only known reaction is uncontrollable shitposting on reddit.",This is bullshit - you're oversimplifying a complex situation to the point of no longer adding anything useful to the discussion.,http://reddit.com/r/circlejerk/comments/4a8ako/c/d0yhzx4,5707,3
3315,circlejerk,EDIT: If this post gets 9001 upvotes then Bernie will be added to the banner of r/pcmasterrace.,23,https://www.reddit.com/r/circlejerk/comments/4b2vt1,"Hillary Clinton: ""I support paid mods for Skyrim""",MY BOUNDARIES ARE EXPANDING AT SUCH A RATE WHERE THEY WILL TOUCH THE MOON,http://reddit.com/r/circlejerk/comments/4b2vt1/c/d15r4in,5771,9
3362,circlejerk,,35,https://www.reddit.com/r/circlejerk/comments/4bbyg8,"TIL that Koko the gorilla loved Bernie Sanders so much that when she met him, she immediately started shouting about the establishment",YOU'RE A FUCKING WHITE MALE,http://reddit.com/r/circlejerk/comments/4bbyg8/c/d18168u,3411,6
3378,circlejerk,"We did it, Reddit!",68,https://www.reddit.com/r/circlejerk/comments/48kada,"BREAKING: Hillary Clinton suspends campaign. ""Despite tonight's results, I've come to the conclusion that I cannot win without the support of r/politics.""",btw im a grill ;3,http://reddit.com/r/circlejerk/comments/48kada/c/d0kcbyx,2118,5
3602,circlejerk,,104,https://www.reddit.com/r/circlejerk/comments/4c5jbn,Hillary Clinton: Batman v Superman is the best superhero movie to come out since Green Lantern.,1F U C4N R34D 7H15 PL3453 P455 17 0N =D,http://reddit.com/r/circlejerk/comments/4c5jbn/c/d1f8fhc,4574,9
3646,circlejerk,,30,https://www.reddit.com/r/circlejerk/comments/48gbnl,"TIL ""Wubalubadubdub"" means ""Feel the Bern"". DAE remember when YouTube changed the rules and put ""bernie"" in place of ""pardon"" to sound more professional","Haha, you crazy memer, you :^)",http://reddit.com/r/circlejerk/comments/48gbnl/c/d0joqq6,749,6
3814,circlejerk,/#lies,25,https://www.reddit.com/r/circlejerk/comments/4cnbb1,"Last year, Hilary Clinton said she was 67; this year, she claims she's 68. Which one is it?","TIL that before reddit ""left"" was just ""ft"".",http://reddit.com/r/circlejerk/comments/4cnbb1/c/d1k2u7f,5536,9
3854,circlejerk,Edit: why is this not on the front page do you guys hate bernie or something?!?!,21,https://www.reddit.com/r/circlejerk/comments/4bz03l,"A jackdaw lands on Bernie's podium during his Portland, Oregon rally. ""That bird is really a dove asking us to unban /u/unidan,"" he said.","It's all about greed, control and power.  It's not actually about the dinosaurs.",http://reddit.com/r/circlejerk/comments/4bz03l/c/d1dnu2i,406,5
3871,circlejerk,,40,https://www.reddit.com/r/circlejerk/comments/48mmkm,ELI5 why Bernie Sanders still hasn't been given an oscar!??!,Hillary Clinton 卐卐卐卐卐卐卐卐卐卐卐卐卐卐卐 卐卐卐卐卐卐卐卐卐卐卐卐卐卐卐,http://reddit.com/r/circlejerk/comments/48mmkm/c/d0kv33m,417,6
3982,circlejerk,Thought I was on /r/circlejerk for a second,22,https://www.reddit.com/r/circlejerk/comments/4bi5ng,George R. R. Martin has died AGAIN,"Yes, but he'll keep writing The Hobbit.",http://reddit.com/r/circlejerk/comments/4bi5ng/c/d1a2uxc,2942,2
3988,circlejerk,THANKS FOR THE GOLD KIND STRANGER EDIT THANKS FOR THE GOLD KIND STRANGER EDIT THANKS FOR THE GOLD KIND STRANGER EDIT THANKS FOR THE GOLD KIND STRANGER EDIT THANKS FOR THE GOLD KIND STRANGER EDIT THANKS FOR THE GOLD KIND STRANGER EDIT THANKS FOR THE GOLD KIND STRANGER EDIT THANKS FOR THE GOLD KIND STRANGER EDIT THANKS FOR THE GOLD KIND STRANGER EDIT THANKS FOR THE GOLD KIND STRANGER EDIT THANKS FOR THE GOLD KIND STRANGER EDIT THANKS FOR THE GOLD KIND STRANGER EDIT THANKS FOR THE GOLD KIND STRANGER EDIT THANKS FOR THE GOLD KIND STRANGER EDIT THANKS FOR THE GOLD KIND STRANGER EDIT THANKS FOR THE GOLD KIND STRANGER EDIT THANKS FOR THE GOLD KIND STRANGER EDIT THANKS FOR THE GOLD KIND STRANGER EDIT THANKS FOR THE GOLD KIND STRANGER EDIT THANKS FOR THE GOLD KIND STRANGER EDIT THANKS FOR THE GOLD KIND STRANGER EDIT THANKS FOR THE GOLD KIND STRANGER EDIT THANKS FOR THE GOLD KIND STRANGER EDIT THANKS FOR THE GOLD KIND STRANGER EDIT THANKS FOR THE GOLD KIND STRANGER EDIT THANKS FOR THE GOLD KIND STRANGER EDIT THANKS FOR THE GOLD KIND STRANGER EDIT THANKS FOR THE GOLD KIND STRANGER EDIT THANKS FOR THE GOLD KIND STRANGER EDIT THANKS FOR THE GOLD KIND STRANGER EDIT THANKS FOR THE GOLD KIND STRANGER EDIT THANKS FOR THE GOLD KIND STRANGER EDIT THANKS FOR THE GOLD KIND STRANGER EDIT THANKS FOR THE GOLD KIND STRANGER EDIT THANKS FOR THE GOLD KIND STRANGER EDIT THANKS FOR THE GOLD KIND STRANGER EDIT THANKS FOR THE GOLD KIND STRANGER EDIT THANKS FOR THE GOLD KIND STRANGER EDIT THANKS FOR THE GOLD KIND STRANGER EDIT THANKS FOR THE GOLD KIND STRANGER EDIT THANKS FOR THE GOLD KIND STRANGER EDIT THANKS FOR THE GOLD KIND STRANGER EDIT THANKS FOR THE GOLD KIND STRANGER EDIT THANKS FOR THE GOLD KIND STRANGER EDIT THANKS FOR THE GOLD KIND STRANGER EDIT THANKS FOR THE GOLD KIND STRANGER EDIT THANKS FOR THE GOLD KIND STRANGER EDIT THANKS FOR THE GOLD KIND STRANGER EDIT THANKS FOR THE GOLD KIND STRANGER EDIT THANKS FOR THE GOLD KIND STRANGER EDIT THANKS FOR THE GOLD KIND STRANGER EDIT THANKS FOR THE GOLD KIND STRANGER EDIT THANKS FOR THE GOLD KIND STRANGER EDIT THANKS FOR THE GOLD KIND STRANGER EDIT THANKS FOR THE GOLD KIND STRANGER EDIT THANKS FOR THE GOLD KIND STRANGER EDIT THANKS FOR THE GOLD KIND STRANGER EDIT THANKS FOR THE GOLD KIND STRANGER EDITTHANKS FOR THE GOLD KIND STRANGER!,29,https://www.reddit.com/r/circlejerk/comments/4ay0d8,THANKS FOR THE GOLD KIND STRANGER THANKS FOR THE GOLD KIND STRANGER THANKS FOR THE GOLD KIND STRANGER THANKS FOR THE GOLD KIND STRANGER THANKS FOR THE GOLD KIND STRANGER THANKS FOR THE GOLD KIND STRANGER THANKS FOR THE GOLD KIND STRANGER THANKS FOR THE GOLD KIND STRANGER THANKS FOR THE GOLD KIND STR,"Surely you mean ""OMS""? You're not a fundie, are you?",http://reddit.com/r/circlejerk/comments/4ay0d8/c/d14ihor,2361,0
4075,circlejerk,EDIT: thanks for the karma faggots xD lmäö,45,https://www.reddit.com/r/circlejerk/comments/4apwrr,"I am 15 years old, and I'm gay. I've been sucking Bernie Sanders's cock before I was born, and I'll be damned if I stop sucking it before the convention.",Came here to say this. ,http://reddit.com/r/circlejerk/comments/4apwrr/c/d12rhtb,2348,3
4127,circlejerk,,50,https://www.reddit.com/r/circlejerk/comments/48dhmz,Bernie Sanders has passed away at age 74.,"I know I'm in the minority here, but I would have voted for him.",http://reddit.com/r/circlejerk/comments/48dhmz/c/d0is5gh,469,6
4436,circlejerk,Edit: Thanks for the gold.,44,https://www.reddit.com/r/circlejerk/comments/492f4d,TIL Jesus couldn't be called that because the letter J didn't exist back then. Instead he was called Bernie Sanders.,"Most of you don’t or won’t believe. Most of you will gravitate towards the nutjob secularists, atheists and liberal pseudo-intellectuals here on Reddit and believe the things they will write in reply because everything I wrote scares the crap out of you. You prefer believing the morons on Reddit who by day are Uber drivers or cashiers and stock clerks at Save-A-Lot or CVS, who know absolutely zilch when it comes to the Bible, because they write things that make you feel better about not believing in God. They make you feel ok about continuing on in your lifestyle of wrongdoing and sin.",http://reddit.com/r/circlejerk/comments/492f4d/c/d0opdrf,2845,6
4439,circlejerk,,98,https://www.reddit.com/r/circlejerk/comments/4asx4m,"TIL that Ernest Hemingway was once challenged to create the saddest story he could in just six words. He responded: ""Bernie Sanders for President; Never Elected.""",I heard Comcast endorsed Shillary.,http://reddit.com/r/circlejerk/comments/4asx4m/c/d13ejsz,6563,6
4452,circlejerk,,24,https://www.reddit.com/r/circlejerk/comments/48r4lj,Hillary Clinton officially arrested.,will she feel the bern every time she takes a leak?,http://reddit.com/r/circlejerk/comments/48r4lj/c/d0lu3eq,150,9
4598,circlejerk,"edit: thanks for the stranger, gold",43,https://www.reddit.com/r/circlejerk/comments/4ag3hq,The worst part about the pollen season is getting sued by the Fine Bros for having an allergic reaction,This week's episode: Poison Ivy!,http://reddit.com/r/circlejerk/comments/4ag3hq/c/d104d0p,4122,5
4685,circlejerk,,58,https://www.reddit.com/r/circlejerk/comments/4cfdm5,FBI force Namco to provide cheat codes for Dark Souls 3,I believe that will be announced in a hydraulic press release.,http://reddit.com/r/circlejerk/comments/4cfdm5/c/d1i4oxc,4421,3
4732,circlejerk,Gib karma,63,https://www.reddit.com/r/circlejerk/comments/4alvw5,TIL /r/suicidewatch entered a /r/suicidewatch lookalike contest. It came in 3rd place behind /r/sandersforpresident and /r/politics,WE DID IT REDDIT,http://reddit.com/r/circlejerk/comments/4alvw5/c/d11uem4,4050,3
4751,circlejerk,Feelburn,36,https://www.reddit.com/r/circlejerk/comments/4972un,Being a male with 2 hands has accurately predicted the last 43 presidents. Sanders will win.,"Don't open that, is spicy",http://reddit.com/r/circlejerk/comments/4972un/c/d0prj3d,2514,7
4878,circlejerk,edit: rip inbox XD,130,https://www.reddit.com/r/circlejerk/comments/4bgqx2,TIL Islam is a religion of peace,gonna be downvoted but i think terrorists are bad,http://reddit.com/r/circlejerk/comments/4bgqx2/c/d192epu,536,3
4920,circlejerk,EDIT 2: RIP imboxEDIT 3: thanks for goldEDIT 3.5: I love u guysEDIT PI: thank you Reddit for making me front pageEDIT 3 subsection a: THANK YOU FOR G0LD FOR REAL,344,https://www.reddit.com/r/circlejerk/comments/4b7ex1,Hilary Clinton: u/Unidan should come back to America to face trial,Now that's a name I haven't heard in a long time ,http://reddit.com/r/circlejerk/comments/4b7ex1/c/d16rcfc,3453,9
5298,circlejerk,,21,https://www.reddit.com/r/circlejerk/comments/4alesh,Marco Rubio dead at 44,http://i.imgur.com/7zCPckJ.jpg,http://reddit.com/r/circlejerk/comments/4alesh/c/d11orif,386,5
5318,circlejerk,,57,https://www.reddit.com/r/circlejerk/comments/48hu8t,Just donated a gallon of sperm to Bernie. Who will match me?,I just purchased Internet service and made a Reddit account to literally say this,http://reddit.com/r/circlejerk/comments/48hu8t/c/d0jon33,398,6
5389,circlejerk,,22,https://www.reddit.com/r/circlejerk/comments/4cs8fx,Hey Reddit! It's April Fool's Day today!!!, 👌👀👌👀👌👀👌👀👌👀,http://reddit.com/r/circlejerk/comments/4cs8fx/c/d1l3hcg,99,3
5431,circlejerk,,34,https://www.reddit.com/r/circlejerk/comments/4ay1rz,"I'm from /r/The_Donald, our memes aren't annoying at all, we got so many memes, fucking memes everywhere, so cool, much kids. Pepe. Cuck. Aids. So topical, so edgy. Politics is fun, really, this isn't forced.",( ͡° ͜ʖ ͡°)/ make memes great again ,http://reddit.com/r/circlejerk/comments/4ay1rz/c/d14mg9s,347,0
5538,circlejerk,(r)ed(d)it: wow gilded?! really?!,120,https://www.reddit.com/r/circlejerk/comments/4c0svj,"Hillary Clinton: ""I really started to enjoy the Simpsons after Season 10.""",/r/circlejerk,http://reddit.com/r/circlejerk/comments/4c0svj/c/d1e3t03,3940,5
5714,circlejerk,I'm a girl btw ;),57,https://www.reddit.com/r/circlejerk/comments/4brlw9,"As a girl, I have taken for granted my whole life that I can get karma just by mentioning I'm a girl",unzips,http://reddit.com/r/circlejerk/comments/4brlw9/c/d1buhgy,2241,1
5742,circlejerk,,22,https://www.reddit.com/r/circlejerk/comments/48hj9x,TIL: The Revenant is just a metaphor for the election. Leo DiCaprio is Bernie Sanders and the Bear is Hillary Clinton.,http://i.imgur.com/h7osj0B.jpg,http://reddit.com/r/circlejerk/comments/48hj9x/c/d0jtcg1,650,6
5926,circlejerk,,22,https://www.reddit.com/r/circlejerk/comments/4b3dcj,Hillary Clinton announces Ellen Pao as running mate,Neither of them even smoked weed before wtf,http://reddit.com/r/circlejerk/comments/4b3dcj/c/d15qz2i,165,9
5976,circlejerk,for*,22,https://www.reddit.com/r/circlejerk/comments/4a3xsx,TIL /r/circlejerk is a high quality subreddit of high quality redditors,I'm just here for the dank memes.,http://reddit.com/r/circlejerk/comments/4a3xsx/c/d0x9q8f,2700,3
6011,circlejerk,,40,https://www.reddit.com/r/circlejerk/comments/499doe,Bernie Sanders dies at 94.,"George Bush 2000 (sending this from Internet Explorer, hope it's not too late)",http://reddit.com/r/circlejerk/comments/499doe/c/d0q2237,294,6
