,subreddit,body,comment_score,self_url,title,comment,link,score,clusters
6182,circlejerk,,47,https://www.reddit.com/r/circlejerk/comments/49ui8q,Genghis Khan has died at age 854,OMG IM SO OLD,http://reddit.com/r/circlejerk/comments/49ui8q/c/d0v0270,611,4
6227,circlejerk,,25,https://www.reddit.com/r/circlejerk/comments/4bwa46,Just had sex with a girl Ama,Are you a boy or grill? xD - le professor oak,http://reddit.com/r/circlejerk/comments/4bwa46/c/d1d0wko,36,1
6233,circlejerk,,105,https://www.reddit.com/r/circlejerk/comments/48x3vw,KEANU REEVES KEANU REEVES KEANU REEVES KEANU REEVES KEANU REEVES KEANU REEVES KEANU REEVES KEANU REEVES KEANU REEVES KEANU REEVES KEANU REEVES KEANU REEVES KEANU REEVES KEANU REEVES KEANU REEVES KEANU REEVES KEANU REEVES," have formally endorsed Senator Sanders for president. We will continue to control the front page with positive Bernie news. So before you start talking shit and bragging about your bitch's win, I'll have you know that we're well versed in downvote brigades. Say RIP to your karma if you try anything cute. Assholes.",http://reddit.com/r/circlejerk/comments/48x3vw/c/d0ncx91,2241,3
6439,circlejerk,,40,https://www.reddit.com/r/circlejerk/comments/48m77h,TIL I'd fuck Hillary,Bill wouldn't ,http://reddit.com/r/circlejerk/comments/48m77h/c/d0kuynt,146,3
6519,circlejerk,Ples help sav my son,35,https://www.reddit.com/r/circlejerk/comments/4bpo22,"If I get 10,000,000,000 Karma I'll stop beating my son with an extension cord.",Edit: thanks for the gold kind stranger,http://reddit.com/r/circlejerk/comments/4bpo22/c/d1bhmhk,384,5
6530,circlejerk,,23,https://www.reddit.com/r/circlejerk/comments/4a9qoh,ELI5: How did this thread become all-time #1 on /r/circlejerk?,savage brutal rekt XD tbh fam :) ur meme game is on fleek . netstat and chill sumtime?,http://reddit.com/r/circlejerk/comments/4a9qoh/c/d0yjwc6,133,3
6805,circlejerk,[deleted],21,https://www.reddit.com/r/circlejerk/comments/4a518p,Bernie Sanders has passed away at age 74,"Wowzers, thanks for le gold kind strangler!",http://reddit.com/r/circlejerk/comments/4a518p/c/d0xlpjr,172,6
6919,circlejerk,,21,https://www.reddit.com/r/circlejerk/comments/4c32ig,"[Urgent] My dad walked in on me masturbating, what do I say to him? (Answer fast, he's still here)","""Can't stump the trump""",http://reddit.com/r/circlejerk/comments/4c32ig/c/d1en2xa,286,5
7057,circlejerk,,40,https://www.reddit.com/r/circlejerk/comments/4asme3,"Hilary Clinton to her critics : ""I'm girl""",She's lying,http://reddit.com/r/circlejerk/comments/4asme3/c/d135oyf,184,1
7115,circlejerk,,31,https://www.reddit.com/r/circlejerk/comments/4bh15x,I am a Belgium airport! AMA,Edit 2: thanks for the stranger kind gold!!!!,http://reddit.com/r/circlejerk/comments/4bh15x/c/d190xdm,25,8
7235,circlejerk,,41,https://www.reddit.com/r/circlejerk/comments/4cfeq8,"Guys, two words: Deadpool",What does this have to do with a hydraulic press? ,http://reddit.com/r/circlejerk/comments/4cfeq8/c/d1hppt1,131,3
7352,circlejerk,,39,https://www.reddit.com/r/circlejerk/comments/4brtkg,Girl.,Upvote because girl.,http://reddit.com/r/circlejerk/comments/4brtkg/c/d1bwdzz,267,1
