,subreddit,body,comment_score,self_url,title,comment,link,score,clusters
7661,circlejerk,The Belgium bombing was an inside job. Trump did 3/22,22,https://www.reddit.com/r/circlejerk/comments/4bhbpu,Trump did 3/22,I LOVE BERNIE tbqh fam,http://reddit.com/r/circlejerk/comments/4bhbpu/c/d197pko,327,9
7662,circlejerk,https://www.youtube.com/watch?v=zWUef8ssb0w,24,https://www.reddit.com/r/circlejerk/comments/4aofg9,Hilary Clintion is dumb, stands for freedom of memes and protection from normies. Thank you and have a nice wank.,http://reddit.com/r/circlejerk/comments/4aofg9/c/d12egya,234,3
7750,circlejerk,,21,https://www.reddit.com/r/circlejerk/comments/4brusg,"Hi! I'm a random asshole from some bullshit company you probably never heard of, AMA!",EDIT: RIP INBOX,http://reddit.com/r/circlejerk/comments/4brusg/c/d1c1azc,320,8
7875,circlejerk,,23,https://www.reddit.com/r/circlejerk/comments/4cqjl8,BREAKING: Trump dead at 69; Cause of death: Crushed on live TV by the hydraulic press channel.,“Assholes always get what they deserve”.,http://reddit.com/r/circlejerk/comments/4cqjl8/c/d1l4i4e,2844,8
7894,circlejerk,,23,https://www.reddit.com/r/circlejerk/comments/492am0,"Trump: when I'm president, everyone will have to reduce their penis size so that I have the biggest dick.",If u have gold please donate it to bernie campaign. We can do this! Hillary is going eat our balls by the end of this campaign. Literally. ,http://reddit.com/r/circlejerk/comments/492am0/c/d0oo0ih,222,9
7943,circlejerk,,224,https://www.reddit.com/r/circlejerk/comments/48roke,"TIL that before Reddit, ""Reddit"" was just "" ""","きみこんにちは。 Redditにへようこそ。新鮮肉amirite？あなたは9GAGで熱いものを超える可能性がありますが、ここではRedditの上、あなたは何もクソないです。私は明らかにあなたがうまくいけば、多分1日の人々はあなたが有名検討するように、あなたの「スマート」のコメントはあなたにいくつかのカルマを獲得するだろうと思っていることを知っているが、いや、それはないでしょう、あなたは有名になることは決してないだろう。あなたの舌を保有していた、多分あなたはまだチャンスがあると思いますが、その代わりに、あなたはどこにでもでたらめを吐き出し、それはあなたを持ってどこに探すことにしました。あなたのコメントを読んだ後、私はほとんど、盲ろう者、ダム、および脳死になりました。すばらしいです！このようなたわごとをコメントしてくださいとFBIは9000000クソのRedditのユーザの大量虐殺のためにあなたを探しています。多分1日あなたが最初にがんで死亡していない場合、あなたは、あなたのお母さんの地下室の外に移動仕事を得る、結婚し、子供を持っていますが、私は実際にそれを疑うだろう。あなたは多分あなたが最初に思っただろう、あなたのコメントをもたらしたであろう異常に混乱した状況を実現していたが、あなたはしませんでしたし、今あなたはクソ価格のきみを支払います。あなたはこれで逃げることができ、それは、本当に、私はほとんど9GAGでたぶん終わりだthatsのが、ここではRedditの上、私たちは許していない、と私たちは忘れないでください。私は、ボタンを押すだけで、あなたのハードドライブ上のポルノのすべての15テラバイトを削除することができます。私はちょうど私があなたのコメントを嫌ってどのくらいのあなたに伝えたいと考えていました。私はちょうどdownvotedと歩いたが、私はちょうど無視することができませんでしたあなたに何かを感じている可能性があります。私は一般的に社会に自分のクソ愚かさと無知の世界に警告する必要がありました。それはどのようにRANDOMウェブサイト上のランダムなインターネットユーザーによってからかわれていると感じるん。あれは何でしょうか？あなたは気にしませんか？それでも橋の下で生きているときに気まあ、15年後のあなたはRedditの上shitposted時間を覚えているだろう。厥すべて、私は実際に行われています。本当に。私はちょうどあなたがどの​​ようなくだらない人に注意を喚起したいと考えました。私はそれが助けにはなりませんけど、私は自分の生意気な女とは違って、貢献したいです。. M'sir, this is not a religion of peace"" -Bernie Sanders 2015.",http://reddit.com/r/circlejerk/comments/48roke/c/d0lxe78,3016,3
8077,circlejerk,"  CLG | eSportspedia | Official Site | Twitter | Facebook | Youtube
TSM | eSportspedia | Official Site | Twitter | Facebook | Youtube        Link: Daily Live Update & Discussion Thread
Link: Event VODs Subreddit      Winner: Trump SoloMid
Game Time: 69:420
   BANS     FINAL SCOREBOARD  Image: End-game screenshot  1,2,3 Number indicates where in the pick phase the champion was taken.     ",57,https://www.reddit.com/r/circlejerk/comments/48mdgq,[Spoiler] Clinton Logic Gaming vs Trump SoloMid / 2016 USA President - Final / Post-Match Discussion,"Bernie banned twice and picked once, impressive.",http://reddit.com/r/circlejerk/comments/48mdgq/c/d0kw509,1113,9
8142,circlejerk,,24,https://www.reddit.com/r/circlejerk/comments/4aeawf,3.141592653589793238462643383279502884197169399375105820974944592307816406286 208998628034825342117067982148086513282306647093844609550582231725359408128481 117450284102701938521105559644622948954930381964428810975665933446128475648233 78678316527120190914564856692346034861045,Build a wall of text and make reddit pay for it. Build a wall of text and make reddit pay for it. Build a wall of text and make reddit pay for it. Build a wall of text and make reddit pay for it. Build a wall of text and make reddit pay for it. Build a wall of text and make reddit pay for it. Build a wall of text and make reddit pay for it. Build a wall of text and make reddit pay for it. Build a wall of text and make reddit pay for it. Build a wall of text and make reddit pay for it. Build a wall of text and make reddit pay for it. Build a wall of text and make reddit pay for it. Build a wall of text and make reddit pay for it. Build a wall of text and make reddit pay for it. Build a wall of text and make reddit pay for it. Build a wall of text and make reddit pay for it. Build a wall of text and make reddit pay for it. Build a wall of text and make reddit pay for it. Build a wall of text and make reddit pay for it. Build a wall of text and make reddit pay for it. Build a wall of text and make reddit pay for it. Build a wall of text and make reddit pay for it. Build a wall of text and make reddit pay for it. Build a wall of text and make reddit pay for it. Build a wall of text and make reddit pay for it. Build a wall of text and make reddit pay for it. Build a wall of text and make reddit pay for it. Build a wall of text and make reddit pay for it. Build a wall of text and make reddit pay for it. Build a wall of text and make reddit pay for it. Build a wall of text and make reddit pay for it. Build a wall of text and make reddit pay for it. Build a wall of text and make reddit pay for it. Build a wall of text and make reddit pay for it. Build a wall of text and make reddit pay for it. Build a wall of text and make reddit pay for it. Build a wall of text and make reddit pay for it. Build a wall of text and make reddit pay for it. Build a wall of text and make reddit pay for it. Build a wall of text and make reddit pay for it. Build a wall of text and make reddit pay for it. Build a wall of text and make reddit pay for it. Build a wall of text and make reddit pay for it. Build a wall of text and make reddit pay for it. Build a wall of text and make reddit pay for it. Build a wall of text and make reddit pay for it. Build a wall of text and make reddit pay for it. Build a wall of text and make reddit pay for it. Build a wall of text and make reddit pay for it. Build a wall of text and make reddit pay for it. Build a wall of text and make reddit pay for it. Build a wall of text and make reddit pay for it. Build a wall of text and make reddit pay for it. Build a wall of text and make reddit pay for it. Build a wall of text and make reddit pay for it. Build a wall of text and make reddit pay for it. Build a wall of text and make reddit pay for it. Build a wall of text and make reddit pay for it. Build a wall of text and make reddit pay for it. Build a wall of text and make reddit pay for it. Build a wall of text and make reddit pay for it. Build a wall of text and make reddit pay for it. Build a wall of text and make reddit pay for it. Build a wall of text and make reddit pay for it. Build a wall of text and make reddit pay for it. Build a wall of text and make reddit pay for it. Build a wall of text and make reddit pay for it. Build a wall of text and make reddit pay for it. Build a wall of text and make reddit pay for it. Build a wall of text and make reddit pay for it. Build a wall of text and make reddit pay for it. Build a wall of text and make reddit pay for it. Build a wall of text and make reddit pay for it. Build a wall of text and make reddit pay for it. Build a wall of text and make reddit pay for it. Build a wall of text and make reddit pay for it. Build a wall of text and make reddit pay for it. Build a wall of text and make reddit pay for it. Build a wall of text and make reddit pay for it. Build a wall of text and make reddit pay for it. Build a wall of text and make reddit pay for it. Build a wall of text and make reddit pay for it. Build a wall of text and make reddit pay for it. Build a wall of text and make reddit pay for it. Build a wall of text and make reddit pay for it. Build a wall of text and make reddit pay for it. Build a wall of text and make reddit pay for it. Build a wall of text and make reddit pay for it. Build a wall of text and make reddit pay for it. Build a wall of text and make reddit pay for it. Build a wall of text and make reddit pay for it. Build a wall of text and make reddit pay for it. Build a wall of text and make reddit pay for it. Build a wall of text and make reddit pay for it. Build a wall of text and make reddit pay for it. Build a wall of text and make reddit pay for it. Build a wall of text and make reddit pay for it. Build a wall of text and make reddit pay for it. Build a wall of text and make reddit pay for it. Build a wall of text and make reddit pay for it.,http://reddit.com/r/circlejerk/comments/4aeawf/c/d0ztcz6,236,3
8201,circlejerk,Bernie eats them the way they're supposed to be eaten:#PeeltheBern,47,https://www.reddit.com/r/circlejerk/comments/4cq5tg,BREAKING: Hillary Clinton found biting into her string cheese instead of peeling it.,☐ Vagina Bacon,http://reddit.com/r/circlejerk/comments/4cq5tg/c/d1kfp7x,816,9
8351,circlejerk,"Not a movie, but jake gyllenhaal.",35,https://www.reddit.com/r/circlejerk/comments/4cqpf0,Which Jake Gyllenhaal played Jake Gyllenhaal a little TOO Jake Gyllenhaal?,"Hi I'm a girl xD
Edit: RIP my inbox",http://reddit.com/r/circlejerk/comments/4cqpf0/c/d1kn110,358,3
8443,circlejerk,Hurry up and updoot to the right.,60,https://www.reddit.com/r/circlejerk/comments/495v8b,"If this gets 1000 updoots, then this sub will merge with /r/circlejerk","Im done now talking about all of this. I just want to make the place as nice as possible but you people cant see through little issues to see the bigger picture. That is an issue with this whole subreddit, to many of people want to shit on the game for whats wrong and never appreciate whats right. But thats just my 2 cents. Dont expect any more replies from me unless they are via mod mail or a PM",http://reddit.com/r/circlejerk/comments/495v8b/c/d0pddaq,979,0
8471,circlejerk,we warned you. we do not forgive. we do not forget. expect us.,20,https://www.reddit.com/r/circlejerk/comments/4annwe,POLICE LINE DO NOT CROSS POLICE LINE DO NOT CROSS POLICE LINE DO NOT CROSS POLICE LINE DO NOT CROSS =================================,-( ͡° ͜ʖ ͡°)╯╲___🔥🔥🔫🔥🔥🚓🔥🔥🔪🔥🔥🚑🔥🔥👮🔥🔥✊🔥🔥 Don't mind me just having a peaceful protest,http://reddit.com/r/circlejerk/comments/4annwe/c/d12c4um,90,0
8482,circlejerk,,32,https://www.reddit.com/r/circlejerk/comments/4ad74c,Bernie Sanders.,Edit: btw MY GIRLFRIEND posted this comment for me ;),http://reddit.com/r/circlejerk/comments/4ad74c/c/d0zckaz,236,6
8483,circlejerk,[deleted],42,https://www.reddit.com/r/circlejerk/comments/4bi80y,[AMA REQUEST] Rob Ford,Edit: Apparently I am dead. ,http://reddit.com/r/circlejerk/comments/4bi80y/c/d19bzhl,353,8
8500,circlejerk,Otherwise you may #FeelTheBern,52,https://www.reddit.com/r/circlejerk/comments/49u2aj,"LPT: When reheating pizza, eat the pizza, not the oven",Edit: thanks for the edit ,http://reddit.com/r/circlejerk/comments/49u2aj/c/d0uwi09,428,5
8560,circlejerk,,29,https://www.reddit.com/r/circlejerk/comments/48hspz,TIL tupac was a black guy who committed black guy crimes because he was a black guy,"I'm a white guy, AMA!",http://reddit.com/r/circlejerk/comments/48hspz/c/d0jnlsi,397,3
8620,circlejerk,EDIT: wow thanks for the gold stranger :),23,https://www.reddit.com/r/circlejerk/comments/4ajcj5,Non-Survivors of attempted murder: what's your story?,Edit: Really? No upvotes or downvotes after 2 minutes? I'm really triggered now.,http://reddit.com/r/circlejerk/comments/4ajcj5/c/d113g8h,461,0
8683,circlejerk,,30,https://www.reddit.com/r/circlejerk/comments/48hx24,Rapper Kanye West has passed away at age 38., for a second,http://reddit.com/r/circlejerk/comments/48hx24/c/d0js1rt,236,6
8759,circlejerk,lmao,70,https://www.reddit.com/r/circlejerk/comments/48ohik,CANT,Bernie Sanders,http://reddit.com/r/circlejerk/comments/48ohik/c/d0lfi1h,1408,3
8848,circlejerk,http://i.imgur.com/vQlMRgi.jpg,30,https://www.reddit.com/r/circlejerk/comments/497no8,"Jon Stewart, former host of The Daily Show, has died at 53.",Source,http://reddit.com/r/circlejerk/comments/497no8/c/d0pmpda,203,4
8871,circlejerk,,22,https://www.reddit.com/r/circlejerk/comments/4ac7i2,"TIL the phrase ""Today I Learned"" can be abbreviated as ""TIL"".",Wow TIL,http://reddit.com/r/circlejerk/comments/4ac7i2/c/d0z5a8v,216,3
9068,circlejerk,,20,https://www.reddit.com/r/circlejerk/comments/4c5ks9,"Hi, I'm a hydraulic press. AMA!",Could you hydraulic press some gold kind stranger ?,http://reddit.com/r/circlejerk/comments/4c5ks9/c/d1f7xw6,108,8
9100,circlejerk,,35,https://www.reddit.com/r/circlejerk/comments/48e2cj,DONALDO TRUMPET IS TRYING TO TAKE LEONARDO DAVINCIS OSCAR AWAY. CLICK THE UPYOURFIRED BUTTON TO FIRE RONALD RUMP,"[1] was created in late 2010. Back before I could get any sort of points or even username recognition, I was creating memes as a clever and easily digestible way to reflect on society, relate some story to my audience, or just be funny. Do you remember rich raven? No? I do. You probably don't remember depression dog, crazy girlfriend praying mantis, introspective pug, or friendzone Johnny either. I remember all of them. In fact, you have only submitted two posts to adviceanimals garnering a total of just 4 points and have not commented there any time recently. So please, respect my judgement regarding the direction of the subreddit and the integrity of posts I have held dear to my heart for nearly 7 years but you have no strong feelings for. Thanks",http://reddit.com/r/circlejerk/comments/48e2cj/c/d0j4wtw,1188,6
9110,circlejerk,,30,https://www.reddit.com/r/circlejerk/comments/4c6q0l,----------------- EVERYTHING BELOW THIS LINE IS JUST PURE AUTISM -----------------,Edit: Here to say this,http://reddit.com/r/circlejerk/comments/4c6q0l/c/d1fluva,474,5
9146,circlejerk,,25,https://www.reddit.com/r/circlejerk/comments/48ygnn,Donald Trump has a massive penis. Politifact: TRUE.,hilary doesnt do it and then after a while she goes to sleep. the next morning she wakes up and finds her bernie still not there. she gets out to check and trump door hand hook vote for,http://reddit.com/r/circlejerk/comments/48ygnn/c/d0nqro6,324,9
9156,circlejerk,,30,https://www.reddit.com/r/circlejerk/comments/4bpdmz,"IF THIS MAKES IT TO THE FRONT PAGE BEFORE THE REDDIT ADMINS FIX THE COMMENTS, /R/CIRCLEJERK WILL BE DISBANDED",I'm just here for the gold.,http://reddit.com/r/circlejerk/comments/4bpdmz/c/d1b8bjc,381,3
9170,circlejerk,,20,https://www.reddit.com/r/circlejerk/comments/4buaht,Sanders's Campaign Crushed by Hydraulic Press,r/circlejerk,http://reddit.com/r/circlejerk/comments/4buaht/c/d1cxdrd,1267,8
9209,circlejerk,,27,https://www.reddit.com/r/circlejerk/comments/4adojx,HAPPY PI DAY DAE INTELLECTUAL XD XD XD,Disappointed.,http://reddit.com/r/circlejerk/comments/4adojx/c/d0zkv9c,336,0
9266,circlejerk,[deleted],21,https://www.reddit.com/r/circlejerk/comments/48rsr8,BREAKING: Bad,DAE HATE SKYLER?!??!!!,http://reddit.com/r/circlejerk/comments/48rsr8/c/d0m1r6d,131,3
9389,circlejerk,,48,https://www.reddit.com/r/circlejerk/comments/49dvz0,/r/Circlejerk dies at age 7,"I used to masturbate onto birds at a local park. Not a thing that I'm particularly proud of but I became quite good at it. I was taking zinc supplements so I was shooting massive loads and it became something of a sport to me. For anyone interested here is your best strategy. first, you need to find an isolated spot so you don't become a sex offender. I found a short kind of channel area where I saw the pigeons would congregate. Next, you arouse yourself. I was usually content with envisioning the occasional jogging lady coming over and taking a shit on my chest and that was enough to fuel the fire but if you're not as sexually charged as me just take some porn on the go. After you're good an horny, you get some bread. My pigeons preferred white bread but healthier birds might have a taste for honey wheat or maybe even multigrain. Fat, unhealthy birds are slower and easier to hit so remember that. Once you are seated on the bench and ready to do the deed, whip your roosevelt out and scatter bread out within a few feet of you. use your judgement based on how far you know you can cum. I was a lonely and depraved soul who could hit targets the size of a thimble at distances up to 4 feet. You wait for the pigeons to begin eating and to get comfortable with your presence. At this point, you want to coo gently and talk sensually to them to gain their trust. Now you're finally ready to cum on your bird. This is a tough part because the rapid motion of masturbation is very frightening to the birds, so you have to be subtle. Once you master a technique, you simply wind it up and let it go, aiming depending on your past cumming experiences. I always came high so I would aim for the neck of the bird and catch it right in the face. It's an extremely satisfying and erotic feeling, seeing those birds reel around covered in cum and maybe even transporting it to other places in the city. Either way I haven't done it in years but every now and then I catch myself gazing wistfully at a flock of birds, cock throbbing and waiting for them to land close to me.",http://reddit.com/r/circlejerk/comments/49dvz0/c/d0r0dqf,257,4
9488,circlejerk,,23,https://www.reddit.com/r/circlejerk/comments/4921pu,"TIL that before reddit, Lebanon was simply known as ""Banon"".","And before 4chan it was just called ""b""",http://reddit.com/r/circlejerk/comments/4921pu/c/d0ooqwo,525,3
9493,circlejerk,I like eating ass,33,https://www.reddit.com/r/circlejerk/comments/49n3mg,DAE remember when Sanders won Michigan? Fuck I'm old.,Upvote if you like eating ass,http://reddit.com/r/circlejerk/comments/49n3mg/c/d0t5jcb,140,8
9516,circlejerk,[deleted],22,https://www.reddit.com/r/circlejerk/comments/4c5lxb,TIL Carl Sagan was brought in to mediate an argument between Richard Dawkins and Neil Degrasse Tyson about which fedora atheists should wear.,"The answer? Bernald ""The Meme"" Sandals",http://reddit.com/r/circlejerk/comments/4c5lxb/c/d1f8ckq,139,3
9544,circlejerk,~BeRnIE 2ol6~,24,https://www.reddit.com/r/circlejerk/comments/4aijo8,I had unprotected sex with a girl I met at a Bernie rally and I'm really starting to feel the bern. Should I see a doctor?,today👏is👏the👏ides of march❗️❗️❗️📆😜 Julius Caesar 💬might💬 have gotten💘the knife😩 but I'm ❌NOT❌🙅 going to stab🔪🔪YOU in the back👌🙏 because you're my 👬HOMIE! send this to 1⃣5⃣ Rulers 👑of Rome that you 🚫won't🚫 stab in the back 🔪🔪 ET TU BROTE?? 🙊,http://reddit.com/r/circlejerk/comments/4aijo8/c/d115w0j,605,1
9738,circlejerk,,20,https://www.reddit.com/r/circlejerk/comments/49nmdj,"BREAKING: Donald trump suspends campaign. ""Despite recent results, I've come to the conclusion that I cannot win without the support of r/politics.""",FEEL THE BERMMMMMMMMMMMMMMMMMNMNNNNNNNNNNNNNMNNNNNNNNNNNNNNMNNNNNNNNNNMNNNNNNNNNNNNNNNNMNNMNNNNNNNNHITLERMNNNNNNNNNNNNNNNNNNNNNMNNNNNNNNNNNNNNNNNNNNNNNNNNNNNNNNNNNNNN,http://reddit.com/r/circlejerk/comments/49nmdj/c/d0t8xj7,143,5
9789,circlejerk,,35,https://www.reddit.com/r/circlejerk/comments/48m4fc,"TIL that before Donald Trump, ""McDonald's"" was just ""Mc's""",bu söyləməyə gəldik,http://reddit.com/r/circlejerk/comments/48m4fc/c/d0ksmvd,2204,3
9833,circlejerk,,23,https://www.reddit.com/r/circlejerk/comments/4b74p8,TIL Bernie Sanders murdered a 12 year old after spray painting his Porsche. The 12 year olds name? Donald Trump.,bernie sanders,http://reddit.com/r/circlejerk/comments/4b74p8/c/d16n8es,248,6
9871,circlejerk,,54,https://www.reddit.com/r/circlejerk/comments/49td5s,Bernie Sanders: True Hillary Clinton: FALSE,politifact.com politifact.com politifact.com politifact.com politifact.com politifact.com politifact.com politifact.com politifact.com politifact.com politifact.com politifact.com politifact.com politifact.com politifact.com politifact.com politifact.com politifact.com politifact.com politifact.com politifact.com politifact.com politifact.com politifact.com politifact.com politifact.com politifact.com politifact.com politifact.com politifact.com politifact.com politifact.com politifact.com politifact.com politifact.com politifact.com politifact.com politifact.com politifact.com politifact.com politifact.com politifact.com politifact.com politifact.com politifact.com politifact.com politifact.com politifact.com politifact.com politifact.com politifact.com politifact.com politifact.com politifact.com politifact.com politifact.com politifact.com politifact.com politifact.com politifact.com politifact.com politifact.com politifact.com politifact.com politifact.com politifact.com politifact.com politifact.com politifact.com politifact.com politifact.com politifact.com politifact.com politifact.com politifact.com politifact.com politifact.com politifact.com politifact.com politifact.com politifact.com politifact.com politifact.com politifact.com ,http://reddit.com/r/circlejerk/comments/49td5s/c/d0unnq7,415,6
9963,circlejerk,,40,https://www.reddit.com/r/circlejerk/comments/4a88ks,Edit: wow this blew up!,Downvoted for visibility,http://reddit.com/r/circlejerk/comments/4a88ks/c/d0y7wxe,203,0
10019,circlejerk,,21,https://www.reddit.com/r/circlejerk/comments/48ugy5,"Bernie Sanders: ""I will build reliable high speed internet and make Comcast pay for it""",bernie.,http://reddit.com/r/circlejerk/comments/48ugy5/c/d0ms3e2,859,6
10024,circlejerk,Boobs,26,https://www.reddit.com/r/circlejerk/comments/4brli1,Boobs,Risky click of the day XDDDDDDDD,http://reddit.com/r/circlejerk/comments/4brli1/c/d1brp5h,95,3
10058,circlejerk,,26,https://www.reddit.com/r/circlejerk/comments/49zayh,The Circlejerk,"Don't mind me, just investing in an early comment in hopes for karma.",http://reddit.com/r/circlejerk/comments/49zayh/c/d0w2ho4,128,3
10119,circlejerk,"Edit 15 - gosh this exploded, I would like to thank my mom.
Edit 54 - Stop gilding me already!!!
Edit 69 - really Reddit",25,https://www.reddit.com/r/circlejerk/comments/4cpqxh,"Hillary Clinton: ""I don't see anything wrong with reposts""","""I did not repost that woman"" - Bill Clinton",http://reddit.com/r/circlejerk/comments/4cpqxh/c/d1klqd2,416,0
10128,circlejerk,,21,https://www.reddit.com/r/circlejerk/comments/4bakdx,"TIL Netflix is legally obligated to do whatever I say if I make a ""Dear Netflix"" post on reddit.","TIL that before reddit, reddit was just eddit.",http://reddit.com/r/circlejerk/comments/4bakdx/c/d17uxow,474,3
10268,circlejerk,,23,https://www.reddit.com/r/circlejerk/comments/49o78z,"BREAKING: In a stunning upset, Bernie Sanders beats Brazil 7-1 in Michigan",H ＥＬＬＯ ＡＭ ４８ ＹＥＡＲ ＭＡＮ ＦＲＯＭ ＳＯＭＡＬＩＡ． ＳＯＲＲＹ ＦＯＲ ＢＡＤ ＥＮＧＬＡＮＤ． Ｉ ＳＥＬＬＥＤ ＭＹ ＷＩＦＥ ＦＯＲ ＩＮＴＥＲＮＥＴ ＣＯＮＮＥＣＴＩＯＮ ＦＯＲ ＰＬＡＹ ＂ｈｅａｒｔｈ ｓｔｏｎｅ＂ ＡＮＤ Ｉ ＷＡＮＴ ＴＯ ＢＥＣＯＭＥ ＴＨＥ ＧＯＯＤＥＳＴ ＰＬＡＹＥＲ ＬＩＫＥ ＹO U,http://reddit.com/r/circlejerk/comments/49o78z/c/d0tr8r1,368,6
10269,circlejerk,I'm not even joking.,28,https://www.reddit.com/r/circlejerk/comments/48c3qq,"Reddit, you have supported me since this campaign first began, and for that, I thank you. Today, I have a huge request for you. I need about 2.70$. - Bernie Sanders.",Ima need about tree fiddy,http://reddit.com/r/circlejerk/comments/48c3qq/c/d0iqr3c,480,6
10282,circlejerk,y,28,https://www.reddit.com/r/circlejerk/comments/48ohhk,STUMP,STUMP THE CAN'T TRUMP,http://reddit.com/r/circlejerk/comments/48ohhk/c/d0llkcb,1400,3
